name,platform,release_date,summary,metascore,userscore
10 Minutes Till Dawn,PC,"May 11, 2022",Shoot down an ever growing horde of Lovecraftian monsters. Choose from a variety of upgrades to create unique and game-breaking builds. Unlock a diverse cast of characters and weapons with unique powers.,tbd,tbd
1001 Jigsaw. Cute Cats 3,PC,"January 19, 2023","Cute and clumsy cats on guard of your good mood! ""1001 Jigsaw. Cute Cats 3"" are ready to help you gain positive emotions!

This is an easy to control game, where you can use hints to pass the level, take a short break, while saving the result, or choose a suitable level of difficulty, if the puzzle is not amenable to the first time. The game is thoroughly detailed, so it is suitable for all types of players.

We'll be waiting for you in the world of amazing and charming seals!",tbd,tbd
15 puzzle,PC,"December 4, 2020","A classic game of puzzle 8 (3x3), 15 (4x4), 24 (5x5) or 35 (6x6) in which player has to move pieces on board so they are from 1 to 8, 15, 24 or 35. Positions of pieces are generated randomly, but every generated game has a solution.",tbd,tbd
2030,PC,"February 21, 2022","It's 2030 AC. Beings from planet Venus are back from a long journey around the universe. In the past they planted us on earth, now are back and see what we did to our planet and their species. 

They declare WAR to humans. Have invaded the human colonies on Moon, unleashing a deadly virus through mysterious high tech machine with a long range beam that teletransport dead people everywhere with thirst of living flesh...

Use military weapons with autocombust ammo, make body parts fly (very satisfying), clear the area from deadly hordes, 3 maps to play multiplayer or solo: JunkYard, Secret Base and Moon Colony.

Be the server and drive on the moon surface with your friends on the top shooting all the place, destroy the big worm and the alien machine, more & more unique multiplayer fun!",tbd,tbd
3-D Ultra Pinball: Creep Night,PC,"September 23, 1996","Once every 100 years a vortex to the underworld opens and chaos reigns as ghosts, gremlins and gargoyles wreak havoc in a haunted castle. Only furious flipper-action and lightning-quick bank shots can vanquish the ghouls as you warp between the castle courtyard, mad scientist's lab, and dungeon catacombs.
If you're good enough to uncover the bonus table, you'll face the Goblin King in a ghoulish grand finale where your speedy reflexes will seal the vortex and send the nasty creatures packing - until the next time.",tbd,5.6
3rd Space Incursion,PC,"November 21, 2007","This game comes bundled with the 3rd Space FPS Vest, a force-feedback vest,  and a 3rd Space-enabled version of Call of Duty II.",tbd,5.0
4Steps,iOS,"September 13, 2010","Special introductory price of $0.99 for a limited time only!

How do you spend your time when you are bored?
How do you kill time when you are waiting for
a bus, a subway, or someone?
'4Steps' was created for you to play in times like these.

'4Steps' is a brain-training game using combinations of images. Now you can enjoy the game and train your brain at the same time with '4Steps'. Enjoy training yourself by solving three different types of puzzles and 45 levels in total.

If you become confident with the puzzles, try the timed challenge mode. As you solve the questions, your imagination and agility will improve.

Intuitive icons and graphics make it easy to play without any explanation. It is so easy and simple that almost anyone can play it immediately.

Just give it a try!


• FEATURES

- High Resolution images for iPhone 4 Retina display
- iOS 4 Multitasking Support
- Level mode : 3 types puzzles, 45 levels in total
- Timed mode : solve as many questions as possible in 60 seconds
- 1800 hand-drawn illustrations
- Openfeint compatible
- 40 different achievements
- Intuitive interface and icons


Like our game? Please rate it or review it in App store",tbd,tbd
69 Andariel Hot,PC,"July 18, 2022","Puzzle with visual novel elements in fantasy style. Dear elf Andariel is waiting for you in the ""House of Flowers"". Play a game with her and in case of victory she will fulfill your cherished desires.",tbd,tbd
8-Bit Hordes,PC,"August 12, 2016","From the team that brought you 8-Bit Armies comes a new fantasy RTS as fast-paced and friendly as the original! 8-BIT HORDES is a colorful strategy-arcade game that is easy to learn for players of all skill levels. Collect resources, build up and defend your base, amass your army of orcs or humans and ultimately crush your opponents! 8-Bit Hordes features offline single-player missions, two-player cooperative missions, AI skirmish mode, and Player-vs-Player Multiplayer modes running on dedicated game servers.",tbd,7.5
9 Clues 2: The Ward,Switch,"September 30, 2022","After responding to a distress call from a secluded psychiatric hospital, a young detective and her partner find themselves struggling to solve a murder. As they press the patients and hospital staff they find that there are dark truths being kept from them. Each new clue only raises more questions. Who killed Doctor Crow? What drove one of the male nurses insane? Who is Zed Rascov? Why is the name of a little girl, Ginger, carved into the wood-paneled wall of the dead doctor's office? Can you unravel the mystery? Find out in 9 Clues: The Ward!",tbd,tbd
A Buttload of Free Games,PC,"April 10, 2020","A collection of over one hundred completely free small games wrapped into one convenient launcher! Slash slimes, shoot lemons, blow kisses, do art comissions, take blood and so much more in these wacky, weird and wild games!
",tbd,tbd
A Glider's Journey,PC,"September 27, 2019","A Glider's journey is a short, minimalist, yet very challenging flight game. The goal is simple: Glide to the next landing zone and regain forward momentum along the way by collecting boosts.
",tbd,tbd
A Monster's Expedition,PC,"September 10, 2020","An adorable and relaxing open world puzzle adventure for monsters who love to learn about humans!
",tbd,tbd
A Sketchbook About Her Sun,PlayStation 4,"April 15, 2022","Confused about her feelings for someone, Lucia, the main character, decides to flee from her city and wanders through a smaller town where she's never been, searching for herself while still tormented by the thought of the person she's attracted to.

The project is an interactive experience divided into 11 segments, each corresponding to a song from Red Ribbon's new album ""Planet X"".

Lose yourself into Lucia's mindscape, divided between her thoughts, drawings and music she's listening to through her journey to re-discover her own self.",tbd,tbd
A Smooth Game (Unlike... Life),PC,"October 4, 2022","This game is about little Jessie (who is awfully depressed)'s journey to find a reason to stay alive. In smooth world life is so much smoother than real life. Don't get it wrong, there are problems in the smooth world as well - they just get resolved quicker and smoother than the real world!

Join with Jessie and see/hear various lives in the smooth world together... and find your own reason to stay alive as well (if you don't have any!)",tbd,tbd
A Wholesome Game About Farming,PC,"December 15, 2022","It's finally here, an honest to goodness game about farming! Nothing but you and the calming iterations of putting seeds into the ground and taking them back out after they've gotten larger and more vegetable-y. Maybe you'll even discover some new recipes to put them in! 

No need worrying about how your actions affect anything happening at night, because probably everyone is asleep and everything is fine. No reason anything that happens at night could affect anything happening on your farm because, as I believe I've said, everyone is sleeping at night.

You'll play as a struggling yet resilient and kind-hearted old farmer named Jep, and if there's any such thing as a ""vampire"" named ""Raluca"" who you ""play as"" at ""night"" I've certainly never heard of her and have no idea what you're talking about.",tbd,tbd
ABC Paint,PC,"September 3, 2018",ABC Paint is a simple Multiplayer VR drawing experience that anyone can start using in seconds. Randomized funny heads for players. Draw on your friends' head or paint them a stick figure body. The non-violent nature and ease of use makes the game suitable for even the youngest of players as their first step into VR.,tbd,tbd
ACA NeoGeo: Aggressors of Dark Kombat,Switch,"September 13, 2018","Anything goes to beat-up your enemies! No rules. No limitations for the fight! Aerial battle, provoking, faking, and throwing... anything is available! Weapons, strangleholds, no mercy even to the weakened enemy. Throwing attack? Fist fight? Try whatever you like! Giving 'em a tough attack, My hot blood burns like fire, Men won't stop fighting 'til they gain victory, Sing this winning song, Hot-blooded fighter's march!",tbd,tbd
ACA NeoGeo: Super Baseball 2020,PlayStation 4,"June 29, 2017","Conventional baseball no longer exists in the year 2020. The ""Super Baseball Association"" has been very profitable over the years with robotics power players up against the strongest of athletes. Due to the secret manipulation of certain robotics team players, abilities have been computer controlled to decide the outcome of certain games, benefitting the SBA. Die hard players discovered the SBA's cheating and have now disconnected several parts of the computers to achieve fair and challenging play. Now the games may continue in the famed ""Cyber-Egg"" Stadium where only power and skill will determine the winner!",tbd,tbd
ACA NeoGeo: The Last Blade 2,Xbox One,"February 15, 2018","The Last Blade 2, originally released in 1998, is the sequel to the fighting game, The Last Blade, which was released a year before. It picks up where the previous title left off and takes the story of battling at the gates of hell to its climax. This time around, there are 16 unique swordsmen from which to choose. Choose from 2 sword types (Strength and Attack). Deflect your enemy's attacks with ""Repel"". You can also cancel game-changing special moves like ""Super Secret Slice"" or ""Hidden Secret Slice"" with a ""Sublime Slash"", which connects to Super Secret Slice - just like in the previous title. And there are even some new features like aerial repels, aerial guards and knockdown recovery. Take your battles to a whole 'nother level!",tbd,tbd
AGEOD's American Civil War: 1861-1865 - The Blue and the Gray,PC,"June 26, 2007",AGEOD’S American Civil War - The Blue and the Gray is a historical operational strategy game with a simultaneous turn-based engine (WEGO system) that places players at the head of the USA or CSA during the American Civil War (1861-1865). [Matrix Games],63,7.3
ARMORED HEAD,PC,"July 31, 2020","ARMORED HEAD is a miniature shooter, where all the action takes place in one arena. The main character is a gladiator who fights against his opponents in pursuit of the grand prize. His task is to defeat 30 waves of opponents, unravel all the secrets of the arena, and win the gold cup. The character will be collecting gold coins, which will help him unlock some useful features of the arena, and become the winner in the battles.",tbd,tbd
AVATAR: Consolidate,PC,"June 29, 2018","AVATAR: Consolidate-survival-shooter Game from the first person, the events of which takes place in outer space and on the planet Kepler 22b.
",tbd,tbd
Absolute Drift,iOS,"July 14, 2018","In Absolute Drift, you will master the art of drifting. Practice your skills in Free-Roam and compete in drift events such as Driftkhana and Mountain Drifting.",tbd,tbd
Absolute Drift: Zen Edition,Xbox One,"August 25, 2017","In Absolute Drift, you will master the art of drifting. Practice your skills in Free-Roam and compete in drift events such as Driftkhana and Mountain Drifting.",tbd,tbd
Abyss Manager,PC,"June 12, 2019","Abyss Manager is a dungeon management simulation game. You will play as a new manager of a small dungeon. Make it a formidable abyss.

You'll start with almost nothing, recruit minions, accumulate money, construct facilities, develop technology, explore the realm, have the dungeon's name up, defeat other dungeons and win the championship of the Dungeon League.",tbd,tbd
Ace Angler: Fishing Spirits,Switch,"October 28, 2022","A request has arrived from the “Encyclopedia of Unfortunate Creatures”. By catching certain creatures in “Ace Angler +”, you can unlock a range of fascinating information about unfortunate creatures.

    Catch the creatures that have escaped from the “Encyclopedia of Unfortunate Creatures” and return them to earn rewards.
    Check the encyclopedia after you’ve caught each animal to learn about their adorably unfortunate characteristics.",65,tbd
Achievement Collector: Zombie,PC,"January 25, 2019","Achievement Collector: Zombie. In this 2d action shooter, you play as a Car that kills zombies with cheese. Shoot the zombies with cheese.",tbd,tbd
Act of Aggression - Reboot Edition,PC,"May 10, 2016","Across three distinct factions each armed with the greatest modern and prototype military weaponry, head into some of the world's most volatile conflict zones, building bases for mass production, establishing resource supply lines, and waging war in Eugen Systems' explosive RTS. 

Act of Aggression - Reboot Edition brings the techno-thriller RTS game Act of Aggression to a higher level. The Reboot Edition offers a full gameplay overhaul: new resource system, playable builder units, new base buildings, simplified research system, and many major mechanic improvements for smoother and more dynamic gameplay in skirmish mode against the AI and in your multiplayer battles.

Either launch the original game or Reboot Edition as you see fit, and experience the new benchmark of real-time strategy games.",tbd,5.0
Adorable Girls,PC,"February 26, 2021","Adorable Girls is a puzzle game, where you need to restore pictures of adorable girls - piece by piece. Relaxing gameplay, based on watching dozens of beautiful girls (and solving puzzles, of cause). Every solved puzzle opens new and new charming pictures in your gallery. And if some puzzles will be too much tangled - in-game assistant always will solve them for you in one click.",tbd,tbd
Adventure Pinball: Forgotten Island,PC,"March 21, 2001","Electronic Arts utilizes the Unreal 3-D game engine, wild animation, and quick camera movements to create a pinball game unlike anything you've seen before.",60,7.3
Aerial Destruction,PC,"February 21, 2017","Aerial Destruction is a helicopter game set during battles between militaries and armed groups of bio-engineered mutants !

3 helicopters to play, easy to fly with cockpit and behind view, having their own armaments, tactics, gameplay and upgradable with credits points to achieve maximum destruction !

7 missions with objectives ranging from defending military outposts for as long as possible, destroying enemy convoys, storming enemy positions, supporting allied troops in assaulting enemy bases, etc...",tbd,tbd
After the 24th Century,PC,"September 15, 2021","In this era of destruction of human civilization, technological mistakes have caused human scientific civilization to slowly regress. Exploring the ruins allows players to go explore what happened before civilization went extinct.

After the 24th Century, the Japanese-style pixel PRG adventure game. Players explore the world in the game, the ultimate exciting action challenge, agile skills and leisurely movement to eliminate endless bosses.",tbd,tbd
Age of Booty: Tactics,iOS,"July 2, 2014",,tbd,tbd
Age of Empires III: The Asian Dynasties,PC,"October 23, 2007","Age of Empires III: The Asian Dynasties is the second expansion pack for Age of Empires III. Engaging gamers of all ages and types in epic warfare in the Eastern world, Age of Empires III: The Asian Dynasties will lead Japanese, Chinese and Indian civilizations to expand their empires. Playable Asian civilizations. Lead one of three unique Asian civilizations — Japan, China and India — to expand their empires and fight for control in the Eastern world. Each Asian civilization, led by powerful leaders, will have unique groups, armies and wonders, as well as buildings that reflect the culture’s architectural style. New gameplay elements. Extending upon the innovative gameplay of Age of Empires III, Age of Empires: The Asian Dynasties will introduce new ways of winning and trading, random map styles that feature remixes of classic Age of Empires game styles, and 15 new Asian Wonders. Returning to the historical, civilization-based single-player campaigns, Age of Empires III: The Asian Dynasties will offer gamers who enjoy the solo experience a chance to engage in strategic combat with Japan, China or India through several engrossing scenarios. [Microsoft]",81,8.4
Age of Wonders: Planetfall - Revelations,PlayStation 4,"November 19, 2019","Revelations introduces the ancient Heritor Secret Technology, new campaign missions, location mechanics and more. Revelations is the first expansion from Triumph Studios for Age of Wonders: Planetfall, the turn-based strategy game with in-depth empire building.",tbd,tbd
Aim Master H,PC,"June 24, 2020","Aim Master H is the first 2D Aim Game on Steam, designed to warmup and boost your aim quickly and easily. Each level counts with a highly stylized hand-drawn unique artwork.",tbd,tbd
AirMech Arena,Xbox One,"May 12, 2015","Free-To-Play Action Strategy 

AirMech Arena is the ultimate fast-paced, real-time strategy game. Control transforming robots, capture and protect bases, and build colossal armies in this highly competitive skill-based combat experience.

By Land and by Air

Transform between air assaults and ground attacks with the touch of a button. With nine AirMechs available all with unique traits and new skins added frequently, theres an ultimate war machine for every play style.

Your Army Your Way

Captain your AirMech with one of 12 pilots, each with diverse strengths and stats. Defend your territory and attack your enemies with over 80 different units. Go head-to-head against your competitors or unleash a hostile battalion. Strategy is open-ended with unlimited options.

Team Up or Go Solo

In AirMech Arena, gamers engage in ferocious real-time battles in a variety of modes. PvP allows up to 3v3 and players have the freedom to start skirmishes at any time. Battle teams are matched by their skill level.

Jump into Co-op mode with a friend to take on the AI, or experience Survival mode with up to four players and face off against endless waves of enemies.

For those who like to roll solo, experience Challenge mode, which tests your skills in timed trials and scope out the competition in Spectator mode and learn new strategies.

A Rich Collection of Items

Earn kudos and experience in battle to unlock a large arsenal of AirMechs, pilots, units, upgrades, special items and customizable skins to have a unique in-game look and gain the upper hand against your opponents. New items are added on a continuing basis.
 
Story
Details

In the future, the last survivors of the Great War continue their fight alongside the ultimate war machine: the AirMech. A shining symbol of science and engineering during the Golden Age of mankind, they were designed to be the most adaptable machines, which makes them the perfect weapon in this new era. In this combative future pilots use salvaged or stolen AirMechs to protect the weak, or to plunder and stockpile resources. Which side do you fight for?",tbd,6.5
Airline Manager 4,PC,"June 14, 2021","Create and manage your own airline strategy.

In this multiplayer aviation simulation game you have the possibility to become bigger than real businesses such as United Airlines, Emirates, British Airways, Lufthansa, American Airlines and Ryanair.

You can even travel while being idle on your couch to a big airport in an amazing city such as New York, Paris, Berlin, Los Angeles, London and Dallas - you don't even have to fly yourself!",tbd,tbd
Aka,Switch,"December 14, 2022","Find inner peace in a top-down, small, open-world game.
Make things better by growing plants, help others, craft and discover a carefully handcrafted island...
but demons from your past might come back to remind you what you want to forget.

***
Explore different biomes, from cloud forests to snowy mountains.
Connect with the island inhabitants.
A farming experience inspired by permaculture.
Gather resources to craft houses, musical instruments, clothes, etc.
Cook and prepare medicines.
Relax and the back of a giant monster, looking at the clouds or in hot springs under a cherry blossom tree.

But your hardest task will be to find a way to talk to these poor souls who are wandering on the island. These war victims are waiting for your help.",60,tbd
Akuya,PC,"December 15, 2016","Have you played enough serious games? Do you want to relax and have some fun with your friends? Well, maybe you can laugh on your own, it is only your decision.

""Akuya"" is not a normal game. It's actually weird to call it a game. IT'S NOT A GAME!

Are you here to buy a ""NO-GAME""? If you are, then go on! Try it!

Be the person who tries desperately to survive on an island in the middle of the ocean. 

Is it possible to survive? Of course not! After all we want to be realistic!

Have fun!",tbd,tbd
Ales Dash,PC,"June 7, 2018","Ales Dash is a Side-Scrolling 3D Action Game. You control Ales running forward and Clear the Level while over obstacles.
",tbd,tbd
Alien Battlefield,PC,"January 27, 2023","The game includes real-time strategic mode and chess mode. In real-time strategic mode, the units that the game can unlock are related to the player's upgrade route. In the chess mode, units will automatically attack the opponent until the winner is determined.
",tbd,tbd
Alien virus,PC,"May 11, 2021","""Alien virus"" is a doomsday survival RPG game. 

An unprecedented virus infection broke out in a secret laboratory in [Hank]. The mayor's hiding of the epidemic caused the death of billions of people worldwide. This virus was named by the United Nations as [Hank Virus Mutantvirus-17].

Pervasive and rapidly spread by air, in less than three weeks time, the virus causes earth's population to plummet, leaving five percent of the original...

The last hope of mankind... the last way...can only go underground...

The last underground fortress [Dharam City], the story begins here...

How to rebuild human civilization in this small fortress? How can humans resist this huge number of mutants?

Was it an accident? Or is it artificial?",tbd,tbd
All Glory to the Pixel King!,iOS,"May 16, 2013","Exciting news citizen! Our glorious King has passed a new law, specifically stating that 'The King's castle must at all times be at least 42% grander, cooler and shinier than those of his enemies.' The time has come for you, brave citizen, to fight for, and almost certainly die for, your King's noble dream to one day have his own private waterpark!Build an awesome fortress, stuff it with soldiers, catapults and whatnot, and lead your army into battle against other players' castles in devious turn-based combat!",tbd,tbd
All You Can Feed: Sushi Bar,PC,"April 20, 2018","All You Can Feed: Sushi Bar let's you handle your own Sushi place. Create Maki, Nigiri or Futomaki, served with Green Tea, Soy Sauce and Wasabi to satisfy to your customers.

The game works like a little tycoon, where you manage your own restaurant. Drag different ingredients onto each other to create over 200 different versions of Maki, Nigiri and Futomaki. Be fast, as you only have a limited amount of time to serve your customers.

Additionally, every level has a goal you must achieve to get to the next level.

After you finished this game you get a feeling of pride and accomplishment.

Are you ready to manage your own Sushi Play, or do you drown in orders?",tbd,tbd
Alpha Hole Prison,PC,"May 19, 2021","A Gay Prison Visual Novel Dating Sim! Earthling Miguel Sanchez has been sentenced to life at Alpha Hole, a notorious space prison. His survival depends on using his charms to convince a powerful ally to protect him.
",tbd,tbd
Amanda's Magic Book 5: Hansel and Gretel,PC,"June 9, 2022","When Amanda is put in charge of watching her nephew Cedric for a few days, she expects a relaxing, enjoyable visit, but Cedric's boundless energy and dreams of heroism soon leave her exhausted. In an effort to settle him down, she convinces him to read a book with her - a fairy tale called ""Hansel and Gretel.""

But books have power, and their peaceful reading experience turns into unexpected peril when Amanda and Cedric are both pulled into the world of the book!

Within the book's pages, villagers live in fear as their children go missing, a witch in the forest hatches a terrifying plot, and a girl begins a desperate search for her vanished brother... Can Amanda and Cedric make sure this fairy tale still has a happy ending?",tbd,tbd
Amber's Tales: The Isle of Dead Ships,PC,"May 1, 2014","Amber receives an alarming phone call - a desperate plea to return home at once because her father has vanished. Her homecoming leads to a shocking discovery. The entire village has been destroyed by a mysterious infestation of salt. All the townsfolk are frozen lifeless like a statues. Even Amber's Mother falls prey to the suffocating salt. Help Amber overcome the salty menace, save her family and restore humanity to the citizens of Port Bridge!",tbd,tbd
American Fugitive,PlayStation 4,"May 21, 2019","A modern take on classic sandbox action. Framed for your father’s murder, you’ll need to do whatever it takes to unveil the real culprit. Tackle thrilling missions for the criminal underworld — just don’t let the cops track you down! Set in the deep south of the 80s, American Fugitive is a love-letter to the classic movies and games of old.",66,5.5
