name,platform,release_date,summary,metascore,userscore
Sniper Elite 4 - Deathstorm Part 2: Infiltration,PlayStation 4,"April 25, 2017","Thanks to Karl’s efforts, the Allies are one step closer to finding out the nature of ‘Deathstorm’,a top secret atomic project. Dispatched to the heavily guarded University of Niroli in the Fascist-controlled north of Italy, Karl must locate an Italian scientist forced to work for the enemy. Deathstorm: Infiltration is the second mission in a thrilling new three-part campaign for 1-2 players, sending Karl on a daring mission well behind enemy lines.",tbd,tbd
Sniper Elite III: Ultimate Edition,Xbox 360,"March 10, 2015","This ULTIMATE EDITION contains the thrilling main game as well as 9 additional DLC packs, including the biggest environments yet in SAVE CHURCHILL Parts 1, 2 and 3 and 6 WEAPONS PACKS CAMOUFLAGE, SNIPER, EASTERN FRONT, HUNTER, AXIS and PATRIOT. Includes free updates to main game 6 new MULTIPLAYER MAPS, CAPTURE THE FLAG mode, TWILIGHT STRIKE Co-Op Mission, and SHOOTING RANGE.",tbd,tbd
Sniper Strike: Special Ops,iOS,"November 27, 2017",,tbd,tbd
Snow Fall,Xbox One,"December 3, 2018",,tbd,tbd
Snow Moon Flower,PC,"December 27, 2022",,tbd,tbd
Soccertron,PC,"March 12, 2015","Practice soccer and other sports the way they are meant to be played: sitting on a couch with your friends!

Soccertron is a local multiplayer sports game for up to 4 players with a simple premise: Kick the ball or your friends to win the match!

Play across 5 different game fields resembling some typical ball games: soccer, basketball and volleyball. But beware! There's no referee around and everything is allowed, even the most treacherous actions!

The game mechanics are simple and accessible but matches are fast and unexpectedly fun, leading to friendly rivalry across the different game fields. Ideal for parties and ""king of the couch"" sessions!",tbd,tbd
Sol Divide: Sword of Darkness,Switch,"March 22, 2018","Psikyo is coming back!!

Vorg heard a rumor that the army of Satan was searching for treasures called Seirei stones which led him to think that the time for revenge has come. In addition, he also knows that one of the Seirei stones was entrusted secretly to King Silverna from Vorg's homeland, the Kingdom of Miltia.

Vorg, who was a holy knight in Miltia, was in the forest town of Neraphai working for a mission when the king of Satan, Ifter, invaded the Kingdom of Miltia with Dhatilos armies.

Upon hearing the news, Vorg immediately returned to Miltia, but the kingdom has been destroyed.

After 7 years, a dark shadow went into the royal room inside the Silverna castle. That dark shadow was Satan, Ifter.

Vorg heads to Silverna castle with his Helos. Satan owns the Sol Divide which is the pair of heilos.

The tale of magic, sword and vengeance starts now!!",tbd,tbd
Solar 2,PC,"June 17, 2011","In most games you see stars in the background, you shoot asteroids or you live on planets. But in Solar 2 you ARE these objects! Enter a universe where you must prove yourself to the resident god-like figure by doing its many bizarre and varied tasks. Or just ignore it and see how big you can grow!

Solar 2 is an open-world, sandbox game set in an infinite abstract universe. Play constructively: grow your system, nurture life on your planets and attack enemy life in huge space battles. Play destructively: crash into other objects and cause chaos, use your orbiting objects like wrecking balls, steal planets from other systems.

Key features:

- Dynamic abstract sandbox universe. Changes and evolves as you do.
- Non-linear missions and open-world gameplay.
- No boundaries. Drift forever in ambient space bliss.
- Full of weird eccentric humor and stuff.
- Extensive custom sound track.",72,6.9
Solitaire Detective: Framed,PC,"July 19, 2016","There is nothing worse than a false charge of a crime you didn't commit. When Mary's groom is accused of robbing a jewelry store and is under arrest, Mary goes out to investigate with the firm belief that George is innocent. Participate in an investigation full of dangers. Believe in yourself and find the true culprit!",tbd,tbd
Sometimes Always Monsters,PC,"April 2, 2020","Join a cross-country bus tour as a newlywed author, and combat vicious rumors that you're a plagiarist. Truth isn't important, when you control the narrative.
",tbd,tbd
Sonny,iOS,"January 12, 2017","Dear Human,

Zombies. You've shot them, stabbed them, sliced and diced them. Today I put you in the shoes of a Zombie. Fight for your life in this crazy and twisted world.

After two solid months of production, we present to you this epic interactive tale of Sonny. I hope you like it!",76,tbd
Sons of Ra,PC,"April 15, 2021","Sons of Ra is the award-winning competitive tower defense game by indie studio Pharaoh Hound Games. Play solo or join your friends in this unique strategic experience.
",tbd,tbd
Soul Survival,PC,"December 8, 2017",,tbd,tbd
SoulCalibur III,PlayStation 2,"October 25, 2005","Soul Calibur III offers players unprecedented variety in gameplay modes and fighting styles. Gamers can guide the fate of their favorite character in the narrative Tales of Souls Mode, play head-to-head with a friend in Vs. Mode, create their own custom fighters in Character Creation Mode, battle as their custom fighter in a real-time simulation in Chronicles of the Sword Mode, engage in unique and original battles in Soul Arena Mode and even recount the history of the franchise in Museum Mode.  Also, the addition of three new characters to the existing family of classic warriors gives Soul Calibur III a collection of more than 25 playable characters, each with their own unique fighting style. New characters Zasalamel, Tira and Setsuka will engage in combat within all-new stages, further enhancing the game's unmatched epic scope and trademark weapons-based fighting engine. [Namco]",86,8.6
Soviet Hentai,PC,"March 5, 2021","Soviet Hentai is a third-person shooter set in the USSR. Explore the Soviet city, test your aim, use a diverse Arsenal of weapons to win shootouts with dangerous enemies.
",tbd,tbd
Space Break,PlayStation 4,"January 21, 2021","Space Break is an arcade game that lets the user break alien bricks with a unique alien saucer paddle and ball. Unique animated Aliens levels, Mini-Bosses and powerups to collect while you progress through the levels. Thirty Levels to play in and battle mini bosses on your way to victory. Single player retro-arcade fun.",tbd,tbd
Space Cube Tower Defense,PC,"March 1, 2021","You control a space station in the form of a cube that protects the planet from invaders.
",tbd,tbd
Space Hulk Ascension: Salamanders Chapter,PC,"February 24, 2015",,tbd,tbd
Space Invaders: The Original Game (SNES),Wii,"November 17, 2008","Experience one of gaming's iconic franchises in this perfect rendition of the arcade classic! Take aim at the field of invaders relentlessly marching toward you. Move quickly, but carefully, and use the barriers for protection as you avoid missiles fired by the aliens and try to destroy all of them before they reach the bottom of the screen. Further enhance the nostalgia by choosing from several modes that simulate different versions of the arcade game (such as upright cabinet or black and white). Or if you want to prove your superior skills to a friend, try the brand-new VS mode and see who can stop the alien menace the quickest. All in all, it's pure gaming at its best, now with no quarters required! ",tbd,tbd
Space Quest Collection,PC,"September 15, 2006",VU is re-releasing this collection of Quest titles for current PC operating systems.,tbd,8.2
Space Revenge,PlayStation 5,"September 30, 2021","Space Revenge is an action-exploration game. Get ready to assault the enemy's base and get your desired revenge. With a top down perspective, twin stick controls and a sci-fi mood to explore the enemy base full of dangers. The BSO will make you feel the tension of the game.",tbd,tbd
Space Travel Jigsaw Puzzles,PC,"October 7, 2020","Space Travel Jigsaw Puzzle is a free jigsaw puzzle game featuring beautiful images from NASA. Full range of difficulty settings to satisfy those looking for a challenge as well as an auto mode for those that just need to zone out and watch.
",tbd,tbd
SpaceColorsRunner,Switch,"August 30, 2019",,tbd,tbd
SpacePig,PC,"November 21, 2017","Journey to the moon as the whimsical SpacePig in this fun and entertaining cartoon-style game.
",tbd,tbd
Sparkle 4 Tales,Xbox One,"November 11, 2020","Begin the emotional journey and start as a small spark of life. Move out of the depths into the bright and peaceful place of grown species.Immerse yourself in the atmospheric surroundings from the beginnings of life, and the beautiful soundtrack to complement your experience. Find and absorb elements to progress further into your evolutionary story.

Have a conversation with the Creator to determine your future. Will you grow into a peaceful being, a bloodthirsty carnivore or something in between? Explore the Void and find your destiny. Become a magnificent being and discover your potential in a unique story.",tbd,tbd
Spec Ops: The Line,PlayStation 3,"June 26, 2012","Spec Ops: The Line is a provocative third-person modern military shooter that challenges players' morality by putting them in the middle of unspeakable situations where unimaginable choices affecting human life must be made. Spec Ops: The Line unfolds within the destroyed opulence of Dubai. Once the playground for the world's wealthiest elite, Dubai has fallen victim to a series of cataclysmic sandstorms. The city's ultramodern architecture lies half-buried under millions of tons of sand. The very sand that blankets the city plays a marquee role in altering combat situations and serves as a powerful but unpredictable force that will both help and hinder players throughout the course of the game. While most people have fled the now-barren wasteland before the sandstorms swept through, U.S. Army Colonel John Konrad and his loyal squad remained behind to protect those incapable of escape. Unable to reach anyone in Dubai after the storm hit, the U.S. Army feared Konrad and his team dead until they picked up a weak distress signal and launched a rescue operation. As U.S. Army Captain Martin Walker, you and your elite Delta Force team are sent to infiltrate the treacherous region to bring Konrad home. Players experience “""The Line,"" that razor's edge known only to men who deal in war. It is the line they cross when death and duty become one and the same. It is the end -- of self and sanity -- when their duty is done and only they remain. [2K Games]",77,8.1
Special Courier,PC,"February 27, 2023","Special things require special attitude!
",tbd,tbd
Special Enquiry Detail: Engaged to Kill,iOS,"May 8, 2013","40% off - limited time offer! Low introductory pricing – ends soon! Try your hand at investigating a murder and bring the killer to justice! Detectives Turino and Lamonte have been assigned to a new investigative unit: Special Enquiry Detail. Their first case is the shocking death of the daughter of two charity fundraisers. So the list of suspects is growing. With pressure from the captain and the mayor to solve the case quickly, the two detectives must uncover the trail that leads to the murderer. You will help with forensics, investigate the clues and suspects to find the murderer and unveil the secrets and deceptions of those involved! Dive into Special Enquiry Detail: The Hand That Feeds and become a New York City detective pursuing justice. TRY IT FREE, THEN UNLOCK THE FULL ADVENTURE FROM WITHIN THE GAME! - Six highly intriguing chapters - 44 locations to examine - 22 mini-game puzzles to solve - A challenging case with multiple suspects- Game Center Support - iPhone 5 support ____________________________ Get new G5 games for up to 40% off! Sign up for the G5 newsletter now! www.g5e.com/e-mail ____________________________ G5 Games - New game apps every week ! Collect them all! Search for ""g5"" in iTunes! Adventure: ? Games Navigator – By G5 Games ? The Secret Society - Hidden Mystery? Nightmares from the Deep: The Cursed Heart, Collector’s Edition ? Whisper of Fear: The Cursed Doll ? Special Enquiry Detail: The Hand that Feeds Strategy: ? Virtual City Playground ? Doomsday Preppers™ ? Build-a-lot 3: Passport to Europe ? The Island: Castaway ? Supermarket Mania 2 ____________________________ VISIT US: www.g5e.com WATCH US: www.youtube.com/g5enter FIND US: www.facebook.com/g5games FOLLOW US: www.twitter.com/g5games",tbd,tbd
Spell Sweeper,PC,"November 22, 2021","Spell Sweeper is a puzzle game which based on ""Minesweeper"".

You get summon by ""Square"" country and fight against ""Sphere"" country as a Hero.

Your goal is to defeat the BOSS!",tbd,tbd
Spelling Challenges and More!,PSP,"September 25, 2007","How good is your spelling? An exciting, enjoyable new game for PSP and DS platforms for the whole family, based on the ever-growing fascination with SPELLING BEES and with 'brain' games, Spelling Challenges and More! is themed around a spelling game show – but also is much more! Your host, Mr. Niceguy, will introduce the game to you and award dollars and prizes. In addition to the Spelling Bee, there are a plethora of word games to test your skills and improve your brain. There are opportunities to acquire bonuses by going for broke and the words will increase in difficulty as you continue to progress. Your ultimate aim is to be invited to the Super Challenge and hit the big jackpot! [Crave]",tbd,tbd
Sphere: Flying Cities,PC,"October 14, 2021","In the not-so-distant future, Earth's moon has been struck by a massive asteroid. With the fallout rendering the terrestrial surface uninhabitable, the ecosystem of the planet collapses. Facing complete annihilation, humanity makes one final and desperate attempt to survive - thanks to newly-created anti-gravity technology, the first flying city ascends as the ultimate bastion of the human race.

As Commander, you have been chosen to take control over the flying city in this relentless and unique strategy-blend that combines the best elements of the city-building and survival-game genres. Rebuild and protect a society in a seemingly uninhabitable environment. Utilize the Anti-Gravitation device to navigate your flying city across the globe into the treacherous unknown. Stay vigilant, as each decision could have ghastly consequences; be prepared to lay it all on the line to succeed, else risk losing everything you worked for.",tbd,tbd
Spiral Clicker,PC,"October 24, 2018",,tbd,tbd
Splash Cars,PC,"November 15, 2021","Paint the world to be a better place with your car, one neighborhood at a time. In an isometric 3D-free driving experience.
",tbd,tbd
Split!,iOS,"June 14, 2012","Armed only with guns and lethal blades for close combat, Red and Blue have to work together against overwhelming odds to bust out of an ultra-high security prison complex.Split locks and loads Tactical Strategy and cunning Puzzle Action in a simple interface that anyone can enjoy. You must swipe Red and Blue to cover and strategic positions to out-maneuver and defeat their adversaries.FEATURES-Evolutionary touch-based Tactical Puzzle gameplay-Clean, colorful sprite graphics and hand painted backgrounds-EXCLUSIVE Dub Step soundtrack courtesy of Syko G, feel the WUB WUB!-Find the Bonus boxes and unlock ranks-New Campaigns with new gameplay and backgrounds coming soon-Available in both free and paid versionsThis is the first release from Touchy Interactive.We want you to have a fulfilling moment whenever and wherever you are. That’s why we make gamesthat are fun, simple and easy to play.If you have any level design ideas for SPLIT, you are more than welcome to share them with us and wewill build them for you. Just send your notes, drawings etc to: ben@touchyinteractive.comPlease send us your feedback too. Our efforts to improve the game depend on it!",tbd,tbd
SpongeBob SquarePants: Revenge of the Flying Dutchman,GameCube,"December 18, 2002","A treasure turns into a terror in SpongeBob Squarepants: Revenge of the Flying Dutchman.  While cruising through Bikini Bottom, SpongeBob discovers several treasure chests.  Ignoring the warning signs, SpongeBob opens the chests, only to discover he has released the Flying Dutchman--an angry ghost that now wants to make SpongeBob and his friends part of his crew.  As you help SpongeBob stop the Dutchman from wreaking havoc in Bikini Bottom, you change costumes, collect gold coins, and interact with all your favorite characters from the TV show.",66,6.7
SpongeBob SquarePants: The Cosmic Shake,PlayStation 4,"January 31, 2023","Wish-granting Mermaid's Tears in the hands of SpongeBob and Patrick... What could possibly go wrong? Sure, the very fabric holding the very universe very together could come very undone, opening up portals into Wishworlds full of knights, cowboys, pirates, and prehistoric snails. But that's nothing everyone's favorite sponge can't handle - with the right cosmic costume! Everybody do the Cosmic Shake!

Features

* Unlock classic and new platforming skills like the Fishhook Swing and Karate Kick
* Don more than 30 F.U.N.tastic costumes like SnailBob and SpongeGar
* Travel to 7 distinct Wishworlds like Wild West Jellyfish Fields and Halloween Rock Bottom
* Experience all the buddy movie banter with SpongeBob's permanent companion Balloon-Patrick
* Meet all your favorite Bikini Bottomites from the series, voiced by their original actors
* Enjoy the in-game soundtrack featuring 101 songs from the series, including Sweet Victory",69,8.3
Spore Creepy & Cute Parts Pack,PC,"November 17, 2008","Add horror and humor to your universe with the Spore Creepy and Cute Parts Pack. With over 100 new parts and paint styles, create grotesque creatures with insect-like limbs, tuberous eyes, and thorny armor plates or make cartoon-style characters with big eyelashes, feathery hair and furry skin. Mix and match 72 new creature body parts, apply one of 48 new paint styles, and bring it all to life with 24 new animations. Expand your creature creativity, with over 100 new Creepy and Cute items. 72 new creature parts - senses, graspers, feet, mouths, limbs. 48 new paint styles - make monstrous beasts or cutesy critters. 24 new creature test drive animations - moonwalk, 'the robot', zombie walk, break dancing and much more. [Electronic Arts]",53,5.5
"Spy Fox in ""Dry Cereal""",Switch,"February 10, 2022","Spy Fox is a suave secret agent who battles dastardly characters such as William the Kid, Napoleon LeRoach, and King Conglomerate with his cohorts Monkey Penny, Quack, and Walter Wireless. Level 4 (primarily children ages 9 to 11).",tbd,tbd
Sqr(2),PC,"January 12, 2021","Sqr(2) is logical platformer with hardcore elements. It contains 3 difficulty and 100+ levels with different gameplay on each level. The simple controls & many mechanics with logical problems make game process more interesting.
",tbd,tbd
Squids Odyssey,Wii U,"May 22, 2014","Squids Odyssey is a unique mix of action strategy and RPG: build your team of Squid heroes for epic turn-based battles against corrupted crabs and shrimps. Steev, Vahine and the rest of the Squids are in danger. An infectious black ooze is corrupting their world. The band of unlikely heroes need to fight back to save their lush underwater kingdoms.",68,7.1
Star Conflict: Elite Pilot Pack,PC,"February 27, 2013",,tbd,tbd
Star Speeder,PC,"May 11, 2018","Challenging and fast paced with randomly generated levels. Control and accelerate the Speeder that slides on a platform through space, avoid hitting the walls and slide to victory.
",tbd,tbd
Star Traders: Frontiers,iOS,"January 31, 2019","You are the captain of a starship venturing through a massive open universe. Customize your crew and take command at the helm of your very own ship as you explore a galaxy torn apart by internal strife, alien threats, and political intrigue.

Command your ship and crew as a space pirate, merchant, bounty hunter, and more in Star Traders: Frontiers an epic space RPG from Trese Brothers Games. Venture forth into a massive open universe, rich with adventure and the lore of the Star Traders. Choose your path by assembling and commanding your custom crew and spaceship in a constantly evolving galaxy torn by internal strife, political intrigue, and alien threats. Will you fly as a pirate terrorizing shipping lanes, join the solar wars as a military captain, or track targets across the stars as a fearsome bounty hunter?

- Explore a rich, open universe: Discover endless procedurally-generated galactic maps, meet unique characters, and take on enemies to conquer the galaxy! 
- Become an intergalactic captain: Take on the role of a spy, smuggler, explorer, pirate, merchant, bounty hunter, and more (26 jobs total)!
- Customize your own spaceship: Choose from more than 350 upgrades and 45 ship hulls to build your very own vessel to venture across the vast reaches of space. 
- Assemble and tailor a loyal crew: Assign talents and equip specialized gear for every spaceship crew member.
- Experience an ever-changing narrative: Decide to make friends or foes with other factions and influence political, economic, and personal vendettas.
- Mold the crew by your choices: As you make decisions and set the tone for your ship, your crew will grow and change to match. Destroy enemy ships with all hands on deck and your crew will become more bloodthirsty and savage. Explore distant worlds and loot dangerous wastelands and your crew will become intrepid and clever ... or scarred and half-mad.
- Varied Difficulty Options! play with save slots to try out different builds or storylines or turn on character permadeath and enjoy classic roguelike experience
- Achievement Unlocks: accomplish story and challenge goals to unlock additional optional (but not better) content like new starting ships and new starting contacts

First there was the Exodus when survivors of a great war left the ruins of the Galactic Core behind in search of a new home in the stars. Scattered worlds were claimed on the fringe of the galaxy. Each pocket of survivors held on to an isolated set of worlds while trying to rebuild under the great law of Shalun. Three centuries later, technology has brought them back together again. Discovery of the hyperwarp has bridged what was once an unimaginable distance between far-flung colonies, long-lost families, and political factions. 

With that reunification has come great economic prosperity. The hyperwarp reestablished the transportation of cargo, goods, and technologies between the quadrants but it has also brought great strife. Political rivalries have been rekindled, blood has been shed in age-old feuds, and the fires of war have been stoked. Amidst the political infighting, a ruthless revolution is rising and the fervent explorers of the hyperwarp have awoken something that was better left asleep.

Our very first game, Star Traders RPG, took hundreds of thousands of gamers on an interstellar adventure. Star Traders' success and overwhelmingly positive reception helped to launch Trese Brothers Games. It was the adventures of our community's star-crossed captains that put us on a trajectory to share more of our worlds, ideas, and dreams.

We set out to capture the loneliness, bravery, and camaraderie of people living together in a spaceship sailing across the stars. It is with great pride that after releasing four other games in the Star Traders universe, we've created a sequel to the original Star Traders RPG. 

Step onto the bridge of your starship, take to the stars, and create your own story in Star Traders: Frontiers.",90,tbd
Star Wars: Empire at War - Gold Pack,PC,"August 15, 2007",Command or corrupt an entire galaxy in the definitive Star Wars strategy collection. It is a time of galactic civil war.,tbd,8.0
Star Wars: Lethal Alliance,DS,"December 14, 2006","Combine the elite weaponry and acrobatic skills of Rianna with the multifunctional defensive and slicing support of Zeeo to create a formidable team. Only by working together can you complete perilous missions and ultimately steal the plans for the Death Star. From the chaotic planet of Coruscant to the dusty, dangerous alleys of Mos Eisley, Rianna and Zeeo must use an arsenal of tricks to complete their mission. Set up holographic disguises to fool Imperial guards, commandeer gun turrets, master death-defying flying escapes and battle carnivorous beasts. First original Star Wars game built exclusively for handhelds: Multiplayer modes enhance collaborative gameplay while taking advantage of the unique capabilities of both the PSP system and Nintendo DS. Your mission takes you to classic destinations such as the Death Star and Tatooine, and allows you to discover never-before-seen locations on Despayre, Danuta and Alderaan. Each new environment offers encounters with unforgettable Star Wars characters and species, including Boba Fett, Kyle Katarn, Princess Leia Organa, Darth Vader, Imperial officers, Rodians, Quarren and stormtroopers. [Ubisoft]",57,tbd
StarShip Constructor,PC,"July 19, 2017",,tbd,tbd
Starfare,PC,"July 20, 2011",,tbd,tbd
State of Decay: Breakdown,Xbox 360,"November 29, 2013","You've survived State of Decay. Now it's time to move forward and tell your own story. Take on an endless campaign with twists and turns based entirely on your own choices. Build up your score in the face of an ever-escalating zombie threat, and compete with survivors around the world. Complete challenges to unlock new heroes with unique weapons and skills. The deeper you go, the tougher it gets, and every choice is yours.",71,6.5
