name,platform,release_date,summary,metascore,userscore
Death Dome,iOS,"October 10, 2012","Optimized for the iPhone 5!No one really remembers where it all started…but before long…it was everywhere. The “M” virus… Most people who showed symptoms were dead within days…but others weren’t so lucky. Mutations were showing up all over the city. The infected were quarantined in a bio-dome force field that encased the city of Palamira. Some called it a “safe zone”, but most know it as the Death Dome. The M virus grew stronger inside the Death Dome and eventually became strong enough to live on its own without a host. Strong enough to become…The Behemoths!The only name I know is Phoenix, I have no recollection of who I was before…The one thing I do know is that they will never dismantle the dome while the behemoths are still alive so I must take them all down….myself!FIGHT FEARSOME ENEMIESBattle Larger-than-life Behemoths in a virus-ravaged city EVOLVING COMBAT!Learn new skills and techniques as you progress through the game. Use them to take down even tougher enemies!FIND LOOT!Scavenge the remnants of a once-thriving cityELEMENTAL WEAPONS AND ARMOR!Wield acid, fire and lightning to exploit enemy weaknesses!Death Dome is free to play, but you can choose to pay real money for some extra items, which will charge your iTunes account.  You can disable in-app purchasing by adjusting your device settings.",tbd,tbd
Death end re;Quest: White Fairy,PlayStation 4,"February 26, 2019",,tbd,tbd
Death off the Cuff - Remastered,PC,"January 11, 2021","""They all stare at you expectantly, like children waiting to be told a bedtime story. Who can blame them? You are, after all, Antoine Saint Germain, the great French Detective. No criminal has ever been a match for you, and everybody is looking forward to a description of your brilliant deductions. There is just one small problem. One tiny detail that makes it different this time. A mere trifle, really. This time you have no idea who did it.""

Inspired by Agatha Christie's Hercule Poirot stories, ""Death off the Cuff"" is a short Interactive Fiction (Text Adventure) game, in which you must bluff your way through the traditional revelatory monologue at the end of a crime story. 

Can you make the murderer reveal him- or herself, without letting anyone know that you hadn't already solved the case?",tbd,tbd
Deep Night Detective - Chapter One,PC,"June 16, 2021","Deep Night Detective, the monochromatic mystery metroidvania! Created by Wilson Taylor with music by Lewmoth!
",tbd,tbd
Def Jam Vendetta,PlayStation 2,"March 31, 2003","It's been three years since D-Mob chased you out of the New York fight circuit and you swore you'd never go back. Now your pal Manny is in trouble and he needs you to bail him out. The plan is simple: get in, win a few fights, pay off his debt, get out. No problem. Well, it turns out that things aren't as easy as they appear. Once in the scene, your past comes back to haunt you. Soon you're over your head and your only chance to get your life back together is to settle a score that has gone too long unpaid. [Electronic Arts]",80,8.6
Defence War,PC,"November 22, 2019","Defence War is a beautiful Tower Defence game which will test your strategic side as you defend off waves of enemies with a wide range of weapons and turrets across 4 different worlds in story mode or arcade.
",tbd,tbd
Degraman: Act I. Vincent,PC,"December 10, 2021","What can change in the life of an ordinary girl when she meets mysterious kidnappers?

Maybe this is a chance to find a harem with incredibly attractive guys? Or the opportunity to end the invisible war for the salvation of all mankind? And what if this is a trap in which the heroine is just a bargaining chip in the game of immoral superhumans?

Only you decide how the fate of the heroine will be decided and whether she will survive, choosing between evil and even greater evil.

A romance visual novel game with female protagonist. The romance is flavored not only with drama, humor and fan service, but suspense and horror, which are all accompanied by a fantastic entourage of characters.",tbd,tbd
Delta Ops: Army Special Forces,PC,"July 2, 2003","Lives depend on you You're part of an elite unit that has been selected to rip out the heart of global terrorism. You have all the military's most advanced weapons at your disposal; so dig in and get ready for the fight of your life! Features Include: Full Multiplayer Combat Compatibility: LAN and Internet Ready; 10 different weapons with variety of ""rates of fire"" for the ultimate arsenal selection! Four multiplayer game modes: Deathmatch, Survival, Capture the Flag and Team Deathmatch; 10 tactical Counter Terrorism Missions to find and destroy leaders of terrorist cells; Use stealth or call in special ""Stinger Missiles"" for reinforcements; the action doesn't get any more life-like than this! [Activision Value]",tbd,tbd
Demon Queen Melissa,PC,"January 20, 2023","The former demon lord ruled over both humans and demons using fear. But then one day, a hero arose, and defeated them. Now a new ruler has emerged. Her name is Melissa. She possesses the power of her predecessor, but having lived for so long in a world with both species coexisting, she's adopted the ways of humans.

One day a human hero named Lufia came to Melissa to offer her a formal greeting. Despite the former ruler being killed by a human, Melissa accepted the greeting with gratitude. However, Melissa's trusted servant Marina notices Lufia acting suspiciously and tries to intervene. In that moment a holy curse gets cast upon them, sealing their powers. How will Melissa regain her power?",tbd,tbd
Demon Turf,Xbox One,"November 4, 2021","The Demon World is inhabited by all kinds of nasties... Most of them lumped into gangs battling for dominion, each led by its own head honcho. Yet even these bad dudes are no match for the Demon King himself! Instead, the task falls to Beebz, a young demon barely a thousand years old, who decides it’s time for her to kick every turf leader’s butt and become the Demon Queen herself.",tbd,tbd
Demon's Tier+,Switch,"June 9, 2020","Enter the dungeons of King Thosgar and destroy his demonic minions. Combining the best elements from Xenon Valkyrie+ and Riddled Corpses EX, this is the latest game in the Diabolical Mind trilogy.",tbd,tbd
Der einzig wahre Auserwahlte,PC,"August 2, 2017",,tbd,tbd
Desire Gambling House,PC,"September 11, 2019",,tbd,tbd
Despot's Game: Dystopian Army Builder,Xbox Series X,"September 29, 2022","A group of people wake up in a strange post-apocalyptic labyrinth - naked, with no memories and with a bunch of weapons. Is this a joke, a crazy experiment, or... a game? You'll find out soon enough, just try not to die first!

Choose your loot and transform the squishy humans into wizards, cultists, ninjas and dozens of other heroes, including the mythical stale pretzel throwers. With perks and class combos, there are thousands of ways to build your army. The man-eating cabbage will appreciate the variety in its diet!

If you can survive the labyrinth, you'll meet THE UNSTOPPABLE END-GAME BUILDS OF OTHER PLAYERS! You'll beat each other to death and only one will be spared by d'Spot. No offense, but in his own game he writes the rules!

Prepare your warriors and let them fight it out on their own! Indirect combat allows you to focus heavily on tactical considerations rather than reflexes. 

The dungeons are generated from scratch every time, and there is no chance puny humans will ever find the way out! And even if they strike lucky - don't worry, there are endless ways to die in Despot's Game!",tbd,tbd
Destropolis,PlayStation 4,"May 26, 2022","Destropolis is a top-down shooter game, inspired by such classic games like ""Crimsonland"", ""Alien Shooter"" or ""Nuclear Throne"". It takes place in a futuristic city, filled with red, cube-like enemies. Tear them to pieces with bullets, lasers and nuclear explosions. Play alone or with friends in a local co-op mode. Destroy as many enemies as you can before they overwhelm you.",tbd,tbd
Destropolis,PC,"August 19, 2020","Destropolis is a top-down shooter game with a fully destructible environment, hundreds of enemies and nuclear explosions. Fight a countless swarm of enemies. Tear them to pieces with bullets, lasers and explosions. Destroy as many of them as you can before they overwhelm you...
",tbd,tbd
Detective Stories: Hollywood,PC,"November 22, 2008","Tinseltown's in trouble and it's up to you to save it! Solve a cavalcade of challenging puzzles in this Hidden Object game! A famous movie studio has lost a fortune in cash, the only copy of its latest blockbuster, and even its leading lady! Unravel the spectacular web of intrigue through intense logic puzzles, mini-games, and a little help from Hollywood mega-stars! Get in on the action of Detective Stories: Hollywood today!",tbd,tbd
Deus Ex GO,iOS,"August 18, 2016","Deus Ex GO is a turn-based puzzle infiltration game set in a stylized interpretation of the Deus Ex Universe. As covert agent Adam Jensen, you’ll use hacking, combat, and augmentations to solve the most intricate puzzles of the entire GO series and unravel the conspiracy behind a terrorist plot.",81,6.4
Devils 'n Dragons Arcade,PC,"December 23, 2022",,tbd,tbd
Dice Legacy,PC,"September 9, 2021","In this roguelike survival city builder, you lead your realm by rolling the dice - literally, because the dice rolls determining your fate aren't happening in the background but are one of the main gameplay elements of Dice Legacy. Discover uncharted lands and guide your loyal subjects.

Put your faith in the dice as you gather resources, construct buildings and expand the borders of your realm. Create a strategy that fits your playstyle as you explore the wilderness. Test your luck as you make contact with the enigmatic factions populating the ringworld. But beware: something wicked is lurking in the mists beyond your realm, waiting for its chance to strike.",70,5.6
Digging Dragon,PC,"March 1, 2019","Explore dungeons and dig up cells that hide not only fabulous treasures, but also dangerous traps.
",tbd,tbd
Digging for Dinosaurs,DS,"November 9, 2010","Engage as a Triceratops battling the mighty Tyrannosaurus Rex, an Eoraptor hunting its prey or an Archaeopeteryx taking flight. Each dinosaur discovery unlocks a game that allows players to be one of these legendary creatures. With each adventure, kids separate fact from myth as they learn the true tales about 21 different dinosaurs roaming the earth millions of years ago! ",tbd,tbd
Digimon Story Cyber Sleuth: Hacker's Memory,PlayStation Vita,"January 19, 2018","Hack your way to the truth! After being accused of a crime he didn't commit, Keisuke Amazawa has no choice but to dive into the digital world and investigate to prove his innocence. Even if that means joining a group of hackers and help them to solve the troubles threatening this mysterious universe. Between real and digital, here lies the truth!

FEATURES:

* Cyber Punk Atmosphere: Dive into a deeper and darker adventure, at crossroads between real and digital.

* Deep and Addictive Gameplay: Experience the perfect mix between adventure, raining and battle with over 320 Digimon to discover. Enjoy a wider range of battle strategies in a classic turn based gameplay enhanced by Digimon's skills, compatibilities and combos.

* The Untold Story: Discover the mysterious backstory to the events that happened in 'Digimon Story: Cyber Sleuth'.",tbd,8.0
Dino Crisis 2,PC,"August 20, 2002","In the first Dino Crisis, Regina fought for survival against raging prehistoric dinosaurs and helped capture rogue scientist Dr. Kirk, but the threat is far from over. Despite these past events, research continued on Third Energy, which led to the disappearance of a military base, a research institute, and an entire town. Armed with the latest in heavy artillery, Regina and her team get to the root of this latest catastrophe. With more dinosaurs, environments, and weapons, you must be ready to hunt or be hunted.",tbd,9.4
Dirty Education,PC,"February 13, 2019",,tbd,tbd
Disgaea 2: Dark Hero Days,PSP,"September 8, 2009","Get a dose of hyper reality as you can discover what the outside world is like at the very same time as Rozalin! Enjoy the all-new Axel Chapters, as you get a glimpse of what makes a Dark Hero tick. Now you can take the fight to Overlord Zenon wherever you want to go! [NIS America]",83,8.2
Disgaea 3: Absence of Justice - Sacrebleu Set,PlayStation 3,"February 12, 2009","This package file adds new custom characters Tink, Yukimaru, and Priere. The download pack also comes with a free bonus item, a Priere theme for your PLAYSTATION 3! Each character can also be purchased separately.",tbd,tbd
Disharmony Blocks II,PC,"April 24, 2014",,tbd,tbd
"Disney Classic Games Collection: Aladdin, The Lion King, and The Jungle Book",Switch,"November 23, 2021","Disney Classic Games Collection is the latest and greatest compilation of classic Disney games based on some of the most beloved Disney movies of all time: Aladdin, The Lion King, and now, The Jungle Book! Now you can play all of the critically acclaimed 16 Bit console versions of Aladdin, along with classic games based on Disney's The Jungle Book!

These all new, fan requested, and beloved games complete this collection, making this the only way to experience all 16-bit console versions of Aladdin and The Jungle Book.

Play as some of your favorited Disney characters, including Aladdin, Simba, and Mowgli, all while experiencing some of the best graphics the 16 Bit era had to offer. Play through multiple versions of each included game and enjoy tons of new features, enhancements, game modes, easy game saves, and display options.",tbd,tbd
Disney Universe,Xbox 360,"October 25, 2011","In Disney Universe, players can select from more than 40 classic and contemporary Disney character costumes, including Alice (""Alice in Wonderland""), Mike (""Monsters, Inc.""), TRON (""TRON: Legacy"") and Stitch (""Lilo & Stitch"") to explore six different worlds inspired by legendary Disney and Disney Pixar films.  Each world will allow players to experience objectives and missions that follow Disney and Disney Pixar movie storylines.  Players will select a character-based costume, with each costume offering a specific tool that changes and grows in power as players adventure through the game.  Disney Universe offers frenetic gameplay, multiplayer with up to three friends and slapstick humor that will appeal to players of all ages.",66,5.8
Disney's Extreme Skate Adventure,GameCube,"September 4, 2003","Disney characters step out of the movies and onto skateboards in Disney's Extreme Skate Adventure. You can play as your favorite Disney and Pixar characters, such as Buzz Lightyear and Woody from Toy Story 2, Simba and Rafiki from The Lion King, and Young Tarzan and Terk from Tarzan. Now you can skate, pull off tricks, and solve puzzles in all the exciting places you've seen in the movies, including Pride Rock, the Jungle Treehouse, and Pizza Planet. ",76,7.6
Dissembler,PC,"February 21, 2018",,tbd,tbd
Dissembler,iOS,"February 21, 2018",,80,tbd
Dizzel,PC,"August 19, 2014","Dizzel is a hardcore, action shooter developed by Neowiz Games and NS Studio. Set in the not too distant future, Dizzel features non-stop, heart-pumping action through a variety of unique maps and game modes. Resembling the third-person shooter style of Gears of War, Dizzel bolsters a variety of powerful weapons from assault rifles and shotguns to massive swords and axes to slay your enemies. Combined with a variety of unlockable skills and power ups, the bloodthirsty soldiers of Dizzel leave only a trail of carnage and bodies in their wake.",tbd,tbd
Dodge It! Online,PC,"January 24, 2023","In this online competitive game, you will have to do your best to survive as long as possible by dodging balls that can kill you in no time!
",tbd,tbd
Dokuro,PC,"December 8, 2014",This chalk-art puzzler tests your wits and pulls at your hearstrings as the bony underdog Dokuro strives to solve and swashbuckle his way through the Dark Lord's castle to save the Princess. ,59,tbd
"Don't Die, Mr. Robot! DX",PC,"August 17, 2022","Deep in the electro-abyss lives a little robot who loves to eat exploding fruit. He also likes staying alive. That’s where you come in… Get the fruit. Avoid the enemies. Try not to die. (Spoilers: you will die).
",tbd,tbd
Donkey Kong Country Returns 3D,3DS,"May 24, 2013",Donkey Kong Country Returns 3D is a portable 3D makeover of the smash-hit Wii game.,83,8.3
Doodle God: Genesis Secrets,PC,"May 10, 2018","Of course, the universe was not created in a day. You'll have to work your way up from simple microorganisms and elements to more complicated animals, tools and even armies. Creator beware, this kind of power may have unintended consequences as creating something as harmless as the wheel could lead to a zombie plague. Fortunately, you are not alone on this cosmic journey. The greatest philosophers and comedians of all time are here to impart their wit and wisdom to help you on your way.

If you loved the award winning Doodle God or any of the games in the Doodle series, you`ll have to try the new Doodle God Genesis Secrets. Players of all ages will enjoy a hidden object game mode with a unique Doodle God twist! Create an entire universe by mixing and matching different combinations of earth, wind, air and fire.",tbd,tbd
Doodle vs Brute : World Domination,iOS,"April 26, 2011","A new kind of doodle war game has arrived!Control a mighty monster and crush doodle armies using your punch. Upgrades body parts and gains skills and new abilities on your way to world domination!Features:- Full retina display support- 37 humorous unique stages to solve (more stages is coming in future updates)- 4 different skills/magic bring chaos and destructions- 15 different implant, each gives unique effect to the brute- 9 different types of enemy infantry units- Game Center Leaderboard and Achievement(more vehicle units is coming in future updates)",tbd,tbd
Dora's Big Birthday Adventure,Wii,"October 26, 2010","It's Dora's birthday and you know what that means ... a fun-filled party with all her friends. The only problem is Dora and Boots are stuck in storybook land and must go on an exciting, magical journey if they hope to make it to the party on time!",tbd,tbd
Dorke and Ymp,PC,"October 19, 2016","Dorke and Ymp is an unreleased Super Nintendo game developed back in the early 1990's by a Swedish company called Norse. The game was developed with unlicensed tools made by the game programmers. Unfortunately the game failed to acquire a publisher and was never released. Luckily we found the original programmer, composer, and artist and we acquired the source code at about 50% of the game.

Plot:- Dorke and his Ymp are sent to a quest to destroy their path and acquire magical artifacts for their evil Wizard Master. You have to help them through puzzles and battles in order to become the Evil Wizards apprentice. 

This are the new features and updates done to the game:
- Over 100 Bugs and Crashing bugs fixed!
- Added a whole new world and levels (Volcano)
- Added Menu, cut-scenes and ending.
- Implemented password system.
- Designed, developed and implemented boss fights (4) according to the original game story.
- Organized the game to be able to play with continuity.

This product is newly manufactured, no original SNES games were harmed in the production of this game.",tbd,tbd
Downpour,PC,"April 28, 2015",,tbd,tbd
Dr. Kawashima's Brain Training for Nintendo Switch,Switch,"January 3, 2020","Get ready to challenge your brain in a variety of ways in Dr Kawashima’s Brain Training for Nintendo Switch. Enjoy new exercises, some of them making use of the right Joy-Con’s IR Motion Camera*, or tap and train with classic exercises from past Brain Training games that you can play using a stylus (included with the packaged version from retail stores) or your finger. It’s in your hands.",64,6.2
Draft Day Sports: College Basketball 2021,PC,"March 5, 2021","Draft Day Sports: College Basketball 2021 puts you in the role of head coach of your favorite college basketball team. Every decision can be made by you from staff hiring, recruiting, scouting and all the way to making each substitution to lead your team to tournament glory and becoming a dynasty.
",tbd,tbd
Dragon Ball FighterZ: Bardock,PlayStation 4,"March 28, 2018","Goku's father jumps into the fight with a set of powerful techniques and special abilities.

This content includes:
* Bardock as a new playable character
* 5 alternative colors for his outfit
* Bardock Lobby Avatar
* Bardock Z Stamp",tbd,tbd
Dragon Ball FighterZ: SSGSS Gogeta,Xbox One,"September 26, 2019","From his debut in the movie, Gogeta (SSGSS) now comes to DRAGON BALL FighterZ!

This content includes:
* Gogeta (SSGSS) as a new playable character
* 5 alternative colors for his outfit
* Gogeta (SSGSS) Lobby Avatar
* Gogeta (SSGSS) Z Stamp",tbd,tbd
Dragon Ball Z: Harukanaru Densetsu,DS,"June 5, 2007","Dragon Ball Z Harukanaru Densetsu is an all new DBZ experience for the Nintendo DS. Harukanaru Densetsu combines strategic card based gameplay and role playing to deliver a game that is easy to understand but hard to master. Players' progression is determined through their use of the cards to evolve characters, strengthen moves and create new moves. [Namco Bandai Games]",57,6.6
Dragon Ball: Xenoverse 2,PC,"October 27, 2016","DRAGON BALL XENOVERSE 2 builds upon the DRAGON BALL XENOVERSE with enhanced graphics that will further immerse players into the largest and most detailed Dragon Ball world ever developed.

DRAGON BALL XENOVERSE 2 delivers a new hub city and the most character customization choices to date among a multitude of new features and special upgrades.

*    Relive the Dragon Ball story by time traveling and protecting historic moments in the Dragon Ball universe
*    Brand new hub city more than 7X the size of the original game with 300 players online at the same time
*    Next-gen visuals bring the Dragon Ball anime experience to life
*    New characters and boss fights
*    More in depth character creation system and battle adjustments
*    Free updates and post launch support for more than a year",78,6.9
Dragon Storm,iOS,"February 6, 2013","The Dragon Storm is rising, and only you can restore glory to the world in this massively multiplayer online (MMO) strategy game. Best of all, the game is FREE to play!======================The mad dragon-god Shadowclaw has brought war and flames to the world of mortals with his ensorcelled army of dragons. In the final climactic battle, the mortal lords fled with the last of the dragon eggs that had not yet fallen under Shadowclaw’s spell. The Goddess of the mortals, with a final burst of divine magic, created mighty flying island ships to save the remnants of her people. As one of the last of the mortal lords and dragon egg protector, you must forge a new destiny.Take to the skies and grow your dragon and kingdom to reclaim the world below with your friends!===== Game Features =====? Grow and build your kingdom online? Complete solo story campaigns? Raise vast armies of fantasy soldiers and creatures? Complete hundreds of quests ? Conquer the world below your flying island ship ? Join an alliance of other dragon lords from all over the world ? Strategize in real time with other players ? Battle rivals for domination on the leaderboards===== Important Notes =====? A network connection is required to play? Works with iPhone 4 or later, iPad 2 or later? Requires iOS 5.1.0 or later ? Optimized for iPhone 5Dragon Storm is free to play, but you can choose to pay real money for some extra items, which will charge your iTunes account.  You can disable in-app purchasing by adjusting your device settings.",57,tbd
Dragon Storm,PC,"April 15, 2020","The main hero was on a desert island, in an incomprehensible place. He don't remember how he turn up here and who is he.

As the game progresses, he begins to gradually remember, collecting memories in particles, like a mosaic.

But also, the awareness comes that the island is not so uninhabited and he is not alone here.

Can the main character find out who he is, where to find help, how to get out of here and how to survive during this time.",tbd,tbd
Draw Souls,PC,"September 7, 2017",,tbd,tbd
Dream Hills: Captured Magic,PC,"December 28, 2013","A treacherous witch has cast Dream Hills into darkness, depriving its residents of happiness and joy. Save your favorite fairy tale characters, break the curse, and restore Dream Hills to its former glory.
",tbd,tbd
DreamWorks Puss in Boots,Xbox 360,"October 25, 2011","This game will be a spin-off based on upcoming film Shrek 2 character, Puss in Boots, as voiced by Antonio Banderas.",tbd,7.0
DreamWorks The Croods: Prehistoric Party!,Wii U,"March 19, 2013",The Croods takes players back to a previously undiscovered era known as the Crocadacious.,tbd,3.0
Dreams Of The Elements,PC,"October 6, 2021","The world is made up of the four natural elements: Water, Wind, Fire, and Earth. These elements are kept in perfect balance by mystical fairies. However, this long-standing balance is currently being threatened by dastardly forces!

Join Aria, Lyle, Gray, and Kaze as they journey across their world to save it from a maniacal plan set into motion by a group of devious and unpredictable villains!

Dreams Of The Elements is a retro-themed JRPG inspired by the classics of the 90's. As the player, you will control a team of four party members, each identifying with one of the four natural elements of water, wind, fire, and earth.",tbd,tbd
Driftwood (2016),PC,"August 8, 2016",,tbd,tbd
