name,platform,release_date,summary,metascore,userscore
Dragon Ball Z: Ultimate Battle 22,PlayStation,"March 25, 2003","The Japanese blockbuster is here! An international smash hit, this vintage Dragon Ball Z® fighter features 22 famed DBZ® warriors for you to recreate epic, one-on-one Dragon Ball Z® battles. Easy to play but tough to master, this long-awaited classic offers matchups from the Buu™, Frieza® and Android Sagas. Experience the DBZ® game that has thrilled fans all over the world!",25,5.1
Dragon Valor,PlayStation,"October 16, 2000","The branching family tree adds a measure of replay value, but the game is average enough that few will want to play it through more than once.",57,8.6
Dragon Warrior VII,PlayStation,"October 31, 2001","You plan to become a humble fisherman of peaceful Estard Island, the only land in a world of ocean. But when you discover the artifacts from an ancient land, you tear the fabric of time and unveil the world that once was. Transported to past lands, you must solve their mysteries and break the spell of annihilation. Prepare for your destiny!",78,8.2
Driver,PlayStation,"June 30, 1999","In Driver, you are the wheelman in a series of Hollywood-style car-chases.  A great getaway driver is only as good as his equipment, which is why Driver has a selection of performance-packed muscle cars, complete with realistic handling, damage modeling, and real-world physics reactions.  Driver also comes fully equipped with a replay/director mode that gives you all the necessary tools to ""film"" their own car chase and multiple views that allow you to look around when you're driving.  Put the pedal to the metal and be the best driver around.",87,8.0
Driver 2,PlayStation,"November 13, 2000","The crime world's fastest getaway driver is back on the streets in Driver 2, the sequel to the action-packed Driver.  Like its predecessor, Driver 2 is an adrenalin-fueled, high-speed car chase through the streets of four cities, where you, as Tanner, infiltrate the criminal underworld, using your driving skills as well as your cunning to disrupt their plans.  All the true-to-life features of Driver; such as realistic car handling, complete with damage modeling and true, real-world physics reactions on all cars; extensive production, giving the cities an amazing realism, featuring recognizable landmarks; new features such as foot missions, dual player, and the enhanced cut scenes make this game a real adrenalin rush.  ",62,7.7
Ducati World Racing Challenge,PlayStation,"January 2, 2001",Ducati World Racing Challenge makes a good effort at providing the kind of gameplay and variety that racing fanatics desire.,68,tbd
Duke Nukem: Land of the Babes,PlayStation,"September 19, 2000","In the distant Future, vicious aliens rule the Earth. Only bodacious babes survive, enslaved by the hostile alien overlords. The women and the world need a hero. And there is only one man big enough for the job! Duke Nukem is back! And he's ready to score!",37,6.9
E.T. Interplanetary Mission,PlayStation,"December 30, 2002","Join E.T. for a space odyssey to six dangerous alien planets. Your mission is to find rare and exotic plant specimens to achieve a truly cosmic goal: Save the UNIVERSE!!! Throughout your adventure, you'll need E.T.'s special powers of Telekinesis, Heart Stun, Healing Powers, and Telepathy to help unravel puzzles achieve mission critical objectives. Do this while neutralizing dangerous alien creatures and threatening government agents, and you'll be a hero.",50,4.0
ECW Anarchy Rulz,PlayStation,"August 18, 2000","While Anarchy Rulz bears the ECW logo, the wrestling action is simply too low impact and refined for the likes of this brutal organization.",43,6.4
ESPN MLS GameNight,PlayStation,"September 19, 2000","Konami has gone to great lengths to integrate two- and four-player capability into each of the game's non-season modes, which opens up the possibility of introducing your sports-phobic friends to a soccer game they can actually play.",70,tbd
Einhander,PlayStation,"May 5, 1998","Pilot the most technologically advanced shooter ever created. You're a suicide pilot up against Earth's final assault. Cut through hordes of enemy fighters and battle the most monstrous bosses ever designed. Pilot fully loaded tactical fighters. Modify speed and agility on the fly. Single, double, and triple gunpod designs. Extendible claw for stealing enemy weapons. Armed for gatling guns, homing missiles, cannons, and more. Two bonus fighters earned through meritorious battle.",89,8.7
Elemental Gearbolt,PlayStation,"June 30, 1998","In a fantastic world divided by class and race, technology from a mysterious source has imbued a young prince with the key to unimaginable power. By means of a Neural Network Computer fueled by the grey matter of unfortunate 'volunteers', he plans to conquer the known world, replacing it with a new order of his design. The only fly in the ointment is disturbing reports of two powerful Elementals storming across the land on a direct course toward the palace. One or two players can assume the identities of these Elementals as they crusade for an unknown master toward a climactic battle. The gripping story unfolds by means of heart-stopping fully-3D action levels interspersed with gorgeous hand-drawn animation scenes. This is the game for which VISA was invented--what are you waiting for?",76,tbd
Evil Dead: Hail to the King,PlayStation,"December 4, 2000","Had the battle sequences not been so maddeningly frustrating and frequent, Evil Dead: Hail to the King would at least weigh in as a decent Resident Evil clone, but they work to make the game almost unplayable.",51,6.3
F1 Championship Season 2000,PlayStation,"September 30, 2000","EA has created the best-looking and best-sounding PlayStation Formula One title to date, and it has excellent gameplay and features to boot.",66,7.5
FIFA 2001 Major League Soccer,PlayStation,"November 14, 2000","Though FIFA 2001 is a solid enough game in its own right, the game's lack of innovation or significant upgrades keeps it from having the same impact as FIFA 2000.",85,7.2
FIFA Soccer 2002,PlayStation,"November 1, 2001","The PlayStation version of FIFA 2002 doesn't quite have all the features available on the PlayStation 2, but it makes a solid case for an investment on its own.",81,6.0
FIFA Soccer 2003,PlayStation,"November 11, 2002",The latest installment in EA Sports' series of soccer games promises to be the most comprehensive to date.,tbd,6.4
FIFA Soccer 2004,PlayStation,"November 4, 2003","FIFA Soccer kicks its game up a few notches with new installment, FIFA Soccer 2004.  This year's action features more advanced levels of player detail and responsiveness.  Play as one of the best players from 16 leagues and 350 teams, from Europe's super leagues to the Americas.  Plus, a new Career Mode gives you the chance to take a team from the lower divisions, battle through ranks, sign new players, and turn them into champions.  With immersive atmospheres, total realism with the world's premier clubs, and improved gameplay, FIFA Soccer 2004 looks to reach the goals of soccer fans.",tbd,7.0
FIFA Soccer 2005,PlayStation,"October 12, 2004","FIFA Soccer 2005 gives you more control than ever with improved button and control sensitivity and an intuitive Off the Ball Control. Now you can take command of players not in possession of the ball by calling in tackles, jostling for space, and sending your teammates on runs as you control the pitch. With more than 350 official team and league licenses from around the world, an enhanced Career mode, and an improved broadcast, FIFA Soccer 2005 gives you a complete and authentic soccer experience.",tbd,5.7
Fear Effect 2: Retro Helix,PlayStation,"February 21, 2001","Fear Effect 2: Retro Helix is the prequel to the critically acclaimed hit Fear Effect on the PlayStation game console. In this chapter, we delve into the colorful histories of the original cast of three mercenaries as well as the extraordinary circumstances that brought them together.
- Hana Tsu-Vachel, our beautiful assassin, trained to deal in love as well as death, desired by many yet belonging to none.
- Royce Glas, a master operative in the field of counter intelligence whose daily existence is haunted by his dark past.
- Jakob 'Deke' Decourt, a cold-blooded killer driven by money and murder.
- Introducing Rain Qin, close companion to Hana with unparalleled beauty wrapped around a dark secret core.

Their adventure will take us to the chaotic alternate reality of Hong Kong, Hells Kitchen in New York City, the formidable Walled City of Xi'an, the lost tomb of the First Emperor of China and finally into the legendary mountain-island of the immortals; Penglai Shan. As they reach their final destination and come face to face with Rain's evil twin sister Mist, in this faithful moment in time, you will get to decide who is to live and who is to die.",84,6.9
Final Fantasy Anthology,PlayStation,"September 30, 1999","Final Fantasy Anthology combines two titles from the Final Fantasy series and offers PlayStation owners a glimpse into the past.  Huge worlds, in-depth storylines, and innovative battle and magic systems, and an incredible cast of characters all make for a deep gaming experience.  The inclusion of Final Fantasy V marks the first time this title has appeared on a console in North America.  Final Fantasy VI, originally released as Final Fantasy III on the SNES system in the U.S., makes its first appearance on the PlayStation.  Both games in this compilation feature never-before-seen CG movies, adding to the appeal of these classics.  ",80,8.7
Final Fantasy Chronicles,PlayStation,"June 29, 2001","When these games came out, they defined what adventures should be. Since then, they have become the most popular and sought-after titles in history. Now you can experience the re-release of two complete, classic games, enhanced with all-new cinemas and features never before seen in the U.S. Final Fantasy IV was previously released as Final Fantasy II, but has been completely restored with new magic, monsters, items, CG cinemas, and added features. Chrono Trigger is a re-release of the original game. This time-traveling prequel to Chrono Cross is enhanced with all-new animated scenes.",89,8.8
Final Fantasy IX,PlayStation,"November 13, 2000","The last Final Fantasy for the PlayStation, Final Fantasy IX returns to the pure fantasy roots that spawned the series.  This latest installment features highly detailed characters, vehicles, and environments, and breathtaking cinema-graphics.  The addition of brand new features such as the story-enhancing Active Time Event system and the return of minigames that grant additional gameplay make Final Fantasy IX not only a memorable gaming experience, but also a significant step forward in the series.",94,9.0
Final Fantasy Origins,PlayStation,"April 8, 2003","Final Fantasy Origins delivers the first two games in the Final Fantasy series.  Originally released in 1998 in Japan, Final Fantasy II never came to North America, but now RPG fans will be able to experience the emotion-packed sequel and its predecessor with all-new event scenes, enhanced graphics, and improved sound.  Whether you're on a quest to recover a magical Crystal or on a journey to stop a merciless ruler, both games provide grand stories complemented with deep characterization and touching music.  ",79,8.5
Final Fantasy Tactics,PlayStation,"January 28, 1998","Featuring over 20 types of Jobs and 400 Abilities through the Job System, beautifully laid out 3D environments and the Charge Time Battle System, FINAL FANTASY Tactics provides strategy-intensive gameplay that takes a twist on the traditional RPG.",83,9.1
Final Fantasy VII,PlayStation,"September 3, 1997","An epic adventure across 3 cd-roms. What begins as a rebellion against an evil corporation becomes much more. And what erupts goes beyond imagination. With vivid landscapes, lush 3D animation and environments, Square Soft's multi-million dollar masterpiece is like nothing ever seen before. ",92,8.9
Final Fantasy VIII,PlayStation,"September 7, 1999","The next chapter in Final Fantasy takes the series to the next level.  Final Fantasy VIII combines an epic storyline with dynamic role-playing elements, breathtaking music, and well-defined characters.  The world of Final Fantasy VIII comes to life in a dazzling display of digital artistry that spans four CDs.  With the addition of an hour worth of CG animation, a new ""Junction"" system, and compatibility with the Dual Shock Analog Controller, Final Fantasy VIII is a breathtaking addition to the series.",90,8.7
Ford Racing,PlayStation,"March 6, 2001","Ford Racing features 12 handpicked cars from Ford's line of U.S. and exotic European models including the Taurus, the Mustang, F-Series, Explorer, GT90, and several concept cars.  In Career mode, you start out as a rookie driver and build your reputation by winning races.  Soon you'll be offered a contract to race for a team.   With 10 realistic tracks, upgradeable cars, sophisticated car physics, and a full race calendar with multiple race types, Ford Racing challenges you to think like a racer.",53,5.8
Freestyle Motocross: McGrath Vs. Pastrana,PlayStation,"November 5, 2000","McGrath vs. Pastrana Freestyle Motocross is the primary candidate for an award no video game wants to win, the uninspired game of the year award.",48,tbd
Frogger 2: Swampy's Revenge,PlayStation,"October 10, 2000","It's fast and furious action from start to finish for Frogger and his new friend, Lillie Frog. Help them save the Frog Babies from Swampy the crocodile.",77,8.2
Galaga: Destination Earth,PlayStation,"October 22, 2000","Of all the old-school to 3D remakes, Galaga: Destination Earth may be the most uninspired.",tbd,7.2
Gold and Glory:  The Road to El Dorado,PlayStation,"December 19, 2000","Gold & Glory: The Road to El Dorado is a simplistic, extremely short experience, with abundant flaws that outweigh its few redeeming features.",34,tbd
Gran Turismo,PlayStation,"April 30, 1998","Welcome to the most advanced racing game ever created! Encounter exhilarating high-speed racing in 11 stunning environments. Feel handling agility and throttle response so convincing, the car seems to be an extension of yourself. Experience the extraordinary world of Gran Turismo!",96,8.6
Gran Turismo 2,PlayStation,"November 30, 1999",The world's most advanced racing game returns with thunderous new features.,93,9.0
Grand Theft Auto 2,PlayStation,"October 25, 1999","Even though the gameplay is largely the same as in the previous GTA, it's still a lot of fun.",70,7.7
Grandia,PlayStation,"September 30, 1999","Join Justin and friends on an epic journey through a captivating story line, providing over 80 hours of intensive gameplay. With vast polygonal worlds to explore and extensive character interaction, Grandia features innovative gameplay with a unique magic combination and character development system and a choice of two battle modes; classic turn-based or automatic. ",89,7.7
Gundam Battle Assault 2,PlayStation,"July 17, 2002","Welcome to a future world where gigantic mobile suits and their human pilots wage a hi-tech winner-take-all war. Your fighting skills will be put to the ultimate test, as you challenge other pilots for the right to be called the best. As Burning Gundam, you're a martial arts specialist in search of your brother. Then as Heero Yuy in Gundam Wing, attempt to destroy Trieze Khushrenada. Finally, use Gundam RX-78 to wage war against the Principality of Zeon. Based on ""Mobile Suit Gundam,"" the hugely popular Japanese anime series, and also seen on TV and available on DVD, Gundam Battle Assault 2 proves once and for all that the bigger they are, the harder they brawl!",80,8.5
Gundam: Battle Assault,PlayStation,"November 6, 2000","Gundam Battle Assault isn't a good enough game to live on its own - the fighting is competent, but hardly compelling for any length of time, and the story mode is completely uninteresting.",61,7.3
Gunfighter: The Legend of Jesse James,PlayStation,"November 30, 2001","It's steel justice in the Old West -- Gunslingin' outlaw Jesse James is layin' down the law on a posse of no-good bandits. These thieves have snatched Jesse's sweetheart, Zee, and done shot dead his partner, Cole. Now is high time to unshuck yer six shooter, save Zee and send them varmints packin' in a pine box!",55,5.4
HBO Boxing,PlayStation,"November 20, 2000",HBO Boxing is another disappointing boxing game that fails to even come close to re-creating the look and feel of the sport in the ring.,26,4.0
Harry Potter and the Chamber of Secrets,PlayStation,"November 14, 2002","Be Harry Potter in a new adventure with more magic, friends, and danger. In his sophomore year at Hogwarts School of Witchcraft and Wizardry, Harry stumbles upon a dark chapter in the school's past. In an effort to confront the powers at the heart of the Chamber of Secrets, you'll learn new spells, undertake new quests, make new friends, and challenge new adversaries. Do you dare take the chance that you might face the evil Lord Voldemort again?",tbd,8.0
Harry Potter and the Sorcerer's Stone,PlayStation,"November 15, 2001","Leave the nonmagical world behind and enroll in Hogwarts School of Witchcraft and Wizardry in Harry Potter and The Sorcerer's Stone.  As Harry Potter, you will hone your magical skills and advance through three terms of study during Harry's first year at Hogwarts.  Each term will challenge you to meet a number of objectives, such as collecting and mixing potions with Professor Snape or piloting a flying broom through the Forbidden Forest in search of Neville Longbottom's Remembrall.  In order to pass the first year of study, players must complete over 29 different objectives, while avoiding enemies and obstacles.",64,7.4
Harvest Moon: Back To Nature,PlayStation,"November 22, 2000","As a child you visited your Grandfather's ranch when vaction plans fell through. Return to the farm that holds fond childhood memories and rejuvenate it's long neglected fields. Tend to your livestock and interact with over 50 characters. As you struggle to make the farm something your grandfather would be proud of, one nagging question remains: What ever happend to the little girl that you knew a decade ago?",82,8.7
High Heat Major League Baseball 2002,PlayStation,"March 14, 2001","While the game isn't bad by any means, it just doesn't stand up to the other games on the market.",66,tbd
Hogs of War,PlayStation,"September 5, 2000","With four people joining in, the number of onscreen explosions, pig-speech comments, and all-around nuttiness nearly lifts the game into the same sphere of quality as Worms or Bomberman.",62,8.5
Hooters Road Trip,PlayStation,"March 26, 2002","There are plenty of bubbly Hooters waitresses, but not much in terms of gameplay.",30,3.1
Hoshigami: Ruining Blue Earth,PlayStation,"December 20, 2001","In the mystical land of Mardias, the Valaimian Empire threatens to upset the balance of power of the continent. Our hero, Fazz and his band of mercenaries are hired to protect one of the Ruins of Xia from the Valaimian forces. Little do they know, that a more sinister power is rising. Will you be able to stop it before the world of Hoshigami is engulfed in eternal darkness?",62,7.0
Hot Wheels Extreme Racing,PlayStation,"September 30, 2001","Tweak your car for optional performance, then hit the track and watch it transform over land, air and sea. Pick up awesome power-ups along the way to wreak serious havoc on your opponents! RACE with what's under the hood, but WIN with what's strapped on top!",53,6.0
IHRA Drag Racing,PlayStation,"November 20, 2001",,tbd,7.4
ISS Pro Evolution,PlayStation,"June 6, 2000","International Superstaar Soccer is back to show the opposition how it's done. The Players choice of soccer games, this new version has improved graphics, awesome player movements and is simply the best re-creation of the beautiful game to date.",94,8.0
Incredible Crisis,PlayStation,"November 6, 2000","The severe fun of Incredible Crisis is all about maintaining your sanity, as you help Taneo's family get home in time for Grandma's Birthday.
It's a happy day and the worst day of their life, as they endure hundreds of hilarious and cardiac-arrest inducing dilemmas.
You'll laugh, cry, freak-out and perhaps soil your shorts, while your mental and physical reflexes are put the test.
The controls are simple, but thumb and forefinger injury is still a risk.
Be warned, this game is severely fun and may cause obsessive compulsive behavior, if not nervous disorders and/or involuntary twitches.",80,7.9
Inuyasha: A Feudal Fairy Tale,PlayStation,"April 10, 2003","Based on the comic by the great manga artist, Rumiko Takahashi, Bandai is proud to present INUYASHA for the PlayStation® game console! Battle your way through the thrilling world of INUYASHA and unlock new characters for hours of pulse-pounding fighting action! Go head-to-head against a friend, or team up in tag-team and versus modes! In this fight for fun, you'll always come out the winner!",69,8.4
Jarrett & Labonte Stock Car Racing,PlayStation,"October 3, 2000",Jarrett and Labonte Stock Car Racing is a solid racing game that's great fun for anyone who really enjoys spending a great deal of time learning all the ins and outs of a totally in-depth racing game.,80,8.0
Jeopardy! 2nd Edition,PlayStation,"September 28, 2000",,tbd,tbd
Jeremy McGrath Supercross 2000,PlayStation,"July 14, 2000",Jeremy McGrath is an unfortunate example of what happens when sports games fall into a rut.,43,tbd
KISS Pinball,PlayStation,"April 25, 2001","KISS fans will be disappointed by the distinct lack of KISS, and pinball fans will be disappointed by the distinct lack of pinball.",26,4.4
Knockout Kings 2001,PlayStation,"October 30, 2000","Knockout Kings 2001 is easily the best iteration of the series thus far, thanks to improved AI, cleaner graphics, and tighter controls.",84,7.4
Legacy of Kain: Soul Reaver,PlayStation,"August 16, 1999","Cast down to the material world, the mysterious entity 'Raziel' seeks vengeance for betrayal by his master: Kain. Cursed to stalk the dark realms of Nosgoth, he must slay his undead brethren; only then can he absorb their souls for the energy he craves. Moving between the spectral and material plane, Raziel must negotiate puzzles, overcome traps and defy blood-chilling enemies to reach his goal - the final battle with Kain!",91,9.0
Looney Tunes Racing,PlayStation,"November 13, 2000","Rev your engines - It's time to burn some Looney Tunes rubber! ACME Corporation, the corporate juggernaut behind such successful products as the Acme Disintegrator Gun and the Acme Portable Hole, is sponsoring a number of racing contests all over the universe for the Looney Tunes characters to compete for the looniest racing champion title.",71,7.8
Looney Tunes: Sheep Raider,PlayStation,"September 27, 2001","Based on one of the most popular cartoons in the Looney Tunes library, players will direct Ralph Wolf throughout the flock of sheep while avoiding detection by Sam Sheep-dog. Your mission, of course, is to use all sorts of outrageous mail-order equipment (Acme, naturally) to get to some delicious lamb chops.",72,8.7
Lunar 2: Eternal Blue Complete,PlayStation,"December 15, 2000","The enchanting world of LUNAR comes  to life once more in the enhanced PlayStation game console version of the classic RPG sequel. Join freewheeling Hiro and the adorable Ruby, a thousand years after the events of LUNAR: Silver Star Story, as they work to unlock the secrets of the Blue Spire... and the strange young girl they found within it! But be careful - dark forces are trying to revive the evil Zophar, and immerse LUNAR in darkness forever. Journey to distant lands in the search of the Goddess Althena, who may be the only one powerful enough to stop Zophar. Along to way, you'll meet exciting new caracters, fight vividly animated monsters, traverse snow-covered mountain peaks, and crawl throught slimy dungeon depths as you wind your way toword the terrifying climax! LUNAR 2 features almost an hour of detailed animation sequences and over 90 minutes of dialogue packed onto three CDs... so what are you waiting for? Go ahead, you deserve to be the hero for once!",86,8.7
Lunar: Silver Star Story Complete,PlayStation,"May 28, 1999","Return to the world of LUNAR, in the completely reworked 32-bit version of the RPG classic. Journey back to a place where dragons yet live, and magic is valued above all else. Join Alex, the young adventurer, as he begins a quest with his friends to save their land from the crushing advance of the Magic Emperor. Explore Dungeons, fight terrifying monsters, and gather information from the locals as you advance toward the explosive encounter with the Magic Emperor himself! Exciting, menu-driven combat will keep you challanged until the last. And, thanks to the storage power of CD and the PlayStation's built-in movie player, LUNAR contains nearly an hour of incredible animation sequences that will get you involved in the story faster than you ever thought possible. Get ready for the ride of your life...",78,8.6
MLB 2002,PlayStation,"May 7, 2001","If you can get past the sluggish pacing and incessant overcomplication, MLB 2002 is a wonderful game.",76,7.3
MLB 2003,PlayStation,"June 17, 2002","If you must have a baseball game that features the latest player rosters and you're bound to the old PlayStation, MLB 2003 is the best and only choice.",78,7.4
