name,platform,release_date,summary,metascore,userscore
MLB 2004,PlayStation,"April 30, 2003","This year's entry in the MLB series adds more authenticity to the baseball experience with new modes, detailed stadiums, and fresh commentary. In MLB 2004, you can build yourself an unbeatable dynasty with Franchise mode, take your favorite team or player through a ten-year Career mode, manage the front office in General Manager mode, or take a rookie from A-Ball to the big leagues in Spring Training mode. Replays, play-by-plays from Vin Scully, and commentary from ESPN's Dave Campbell, enhance the action from Opening Day to the Fall Classic.",68,tbd
MLB 2005,PlayStation,"March 4, 2004","MLB 2005 immerses you in the baseball experience.  This year's installment features EyeToy functionality that puts your face in the game, a new Career mode that takes gamers from Class-A ball to the Fall Classic, and a deep Franchise mode that allows players to control every aspect of running a ball club from parking prices to player contracts.  You can even join 32-team tournaments online and use the USB headset to bark out plays like a manager.",tbd,7.4
MTV Sports: Pure Ride,PlayStation,"September 30, 2000","MTV: Pure Ride is an excellent snowboarding game, but it's yet another example of a development house shifting the majority of its resources to the next generation of hardware.",70,tbd
MTV Sports: Skateboarding featuring Andy Macdonald,PlayStation,"September 12, 2000","MTV Skateboarding is a perfect example of cashing in on a recently established genre, yet unlike games like Street Sk8er 2 or Grind Session, it doesn't bring anything worthwhile to the table.",40,tbd
MTV Sports: T.J. Lavin's Ultimate BMX,PlayStation,"March 27, 2001","Landing vert tricks and pulling off long grinds can be a chore, because the game has a seemingly random system of determining whether or not your bike is straight enough to land. A coin toss would be more predictable.",47,tbd
Madden NFL 2001,PlayStation,"August 22, 2000","Get ready for a dose of bone-crunching football action on the PlayStation 2 with Madden NFL 2001. Madden NFL 2001 features an all-new and exclusive NFL Coaches Club license, which means you'll see coaches on the sidelines and hear them yelling encouragement, comments and criticisms. Madden 2001 also features individualized details, easy-to-use interface, dynamically enhanced audio and play-by-play recorded with John Madden and his broadcast partner, Pat Summerall, and more!",90,6.8
Madden NFL 2002,PlayStation,"August 13, 2001","While Madden 2002 isn't reinventing football on the PlayStation, it is really the best you're going to get on the system.",88,7.3
Madden NFL 2003,PlayStation,"August 13, 2002","The game of football just got more real with Madden NFL 2003.  This year's installment of the Madden NFL Football series features more depth, new animation, realistic player AI, and in-depth play modes.  Hop on John Madden's Cruiser Tour Bus and travel to all NFL cities to complete skilled tasks in the all-new Mini-Camp mode.  The improved graphics and presentation now show sidearm QBs, gang-tackling, stand-still receiver catches, and more than 300 realistic player faces.  Madden NFL 2003 gives you more control than ever before, with faster game speed, a more finely tuned passing game, and independent audibles for defensive line, linebackers, and defensive backs.",tbd,7.6
Madden NFL 2004,PlayStation,"August 12, 2003","In its 14th season, Madden NFL Football isn't showing signs of slowing down. Madden NFL 2004 adds new features such as Playmaker Control and Owner Mode to it's deepen its football simulation. This year, players can make adjustments after the snap and create championship caliber plays with the easy-to-use Playmaker Control. The new Owner mode allows you build and manage your own stadium in addition to your own team. Compete against other players through EA Sports Online Tournaments. With new plays, modes, and online play, Madden NFL 2004 is the most complete, authentic installment in the series yet.",tbd,8.2
Madden NFL 2005,PlayStation,"September 7, 2004","Madden NFL 2005 introduces the Hit Stick, a new feature that lets players turn a game around with a crucial tackle. Along with all-new defensive preplay controls and defensive artificial intelligence enhancements, the defense now has a diverse arsenal of weapons available. Also, the depth of Franchise mode grows with the addition of Storyline Central, a weekly radio talk show that discusses current stories regarding your team and the league. With even more Franchise mode additions, hundreds of new animations, and the new Create-a-Fan feature, Madden NFL 2005 takes the series to the next level.",tbd,7.3
Martian Gothic: Unification,PlayStation,"November 4, 2001","MARTIAN GOTHIC: UNIFICATION is a spine-tingling action-adventure on a cold and isolated planet. Your three-member team descends upon the derelict Vita base located on Mars, quickly realizing the ancient nightmare that awaits. The investigation becomes a battle to stay alive as the team uncovers the mystery of Vita base, until finally confronting the appalling secret hidden deep underground, a secret older than humanity itself...",64,6.7
Mat Hoffman's Pro BMX,PlayStation,"May 14, 2001",The soundtrack rivals Wipeout XL for the title of best licensed soundtrack ever.,80,8.3
Medal of Honor,PlayStation,"October 31, 1999","Tomorrow is D-Day. Tonight you land behind enemy lines. The tide of the way is in your hands. You are an elite Special Forces agent sent to execute covert operations, search and rescue missions, and commando raids. Fight to win the medal of Honor in the only game that lets you take on Nazis in WWII.",92,8.9
Medal of Honor Underground,PlayStation,"October 23, 2000","Germans invaded your country. Your leaders surrendered, and some are now collaborating with the enemy. Join the resistance and battle the Reich from Paris to North Africa.",86,8.7
Mega Man Legends 2,PlayStation,"October 24, 2000","Mega Man, Roll and all your favourites are back in an entirely new 3-D adventure. Far away, in an isolated wasteland, a mysterious girl and an infamous treasure have been discovered. It's the legendary ""Sealed Key"", rumoured to unlock an even greater mystery known as the Great Legacy. What power does the Great Legacy hold? Now, a race unfolds as Mega Man and his friends embark on a journey which will alter their destinies forever. 

",76,8.6
Mega Man X5,PlayStation,"February 1, 2001","The year is 21XX and the chaos of the Reploid Wars has passed.  Lunar colonization is at its peak.  The largest colony, Eurasia, is unexpectedly taken over by an unknown band of galactic terrorists.  It's artificial gravity device has been hacked and Eurasia is now on a collision course with Earth.  The only way to stop it is to deploy and ancient beam cannon, Codename: Enigma.  Join Mega Man X and his pal, Zero as they race against time to collect the necessary parts to restart Enigma, prevent total annihilation and save life on Earth!",76,8.7
Mega Man X6,PlayStation,"December 4, 2001","It's been three weeks since Earth's near collision with the space colony Eurasia. The disaster was averted by Zero's heroics. Now, on a bruised and battered planet, tales of rampagning reploids are surfacing. It's up to Mega Man X to investigate these mysteries but it's not going to be easy. Mega Man X must battle through a maze of levels and rescure reploids along the way. Return to battle agagin and again with the new Nightmare System, which randomizes level maps, enemies and endings based on how you play the game. Mega man X is back and now it's personal!",65,7.8
Men in Black - The Series: Crashdown,PlayStation,"November 1, 2001",,59,6.4
Metal Gear Solid,PlayStation,"October 21, 1998","You are Snake, a government agent on a mission to regain control of a secret nuclear weapons base from terrorist hands. Lightly armed and facing an army of foes, Snake must avoid firefights in order to survive. If Snake can locate them he can utilize advanced hardware, ranging from silenced pistols to ground-to-air missiles. Enemies react to sight and sound - so stay quiet and stay in the shadows. State-of-the-art graphics: textures, transparencies, models and explosions. Taut, gripping story with multiple endings - a truly cinematic experience.",94,8.4
Metal Slug X,PlayStation,"April 14, 2001","Brace yourself for non-stop battle action in the hit straight from the arcades! In Metal Slug X, you'll chose from four tough-as-nails soldiers ready for missions that only the best could survive. Rescue hostages while blowing terrorists back to the stone-age using your personal weaponry AND their own machine!",85,8.6
Mike Tyson Boxing,PlayStation,"October 23, 2000",Mike Tyson's Boxing just doesn't have the depth of Knockout Kings or the immediate satisfaction found from the arcade style of play in Ready 2 Rumble.,44,tbd
Monster Rancher,PlayStation,"November 30, 1997","Remember when you though monsters were lurking in every dark corner of your house? Well, you were right: Every CD YOU OWN CONTAINS A MONSTER. Every PC CD, ever music CD and every game CD each has a monster living inside. Use Monster Rancher to safely release these monsters into a virtual environment where YOU'RE THE MASTER, TEACH YOUR MONSTER ATTACK MOVES. Capture your monster (on a memory card) and take him to a friend's house for some HEAD TO HEAD FIGHTING ACTION. We dare you to find and train your ultimate fighting machine!",86,8.6
"Monsters, Inc. Scream Team",PlayStation,"October 30, 2001",More sophisticated players will likely find this 3D platformer to be too repetitive and easy.,65,7.2
Mortal Kombat: Special Forces,PlayStation,"June 30, 2000","Explore the world of Mortal Kombat! Play as the battle-hardened Jax in his search for his arch-enemy: the supercriminal Kano. Uncover the pieces to this mysterious story as you battle through complex levels using special moves, combos and weaponry to force the final showdown!",28,2.8
Motocross Mania,PlayStation,"July 9, 2001","With so many better supercross games on the market, many of them older and available at similar bargain-basement price points, Motocross Mania has no place in the market.",34,5.3
NASCAR 2001,PlayStation,"September 19, 2000","Despite the haphazard audio, NASCAR 2001 is definitely a game that's worth owning.",73,7.1
NASCAR Heat,PlayStation,"November 6, 2000","NASCAR Heat isn't quite the all-encompassing racing simulation that Electronic Arts' NASCAR 2001 is, but features like the beat the heat mode make the game worthwhile for any NASCAR fan.",62,tbd
NASCAR Thunder 2002,PlayStation,"October 2, 2001",A number of unfortunate gameplay adjustments overshadow the few welcome additions found in this year's release.,69,7.0
NASCAR Thunder 2003,PlayStation,"September 19, 2002","Get behind the wheel of the world's tightest, sleekest stock cars and get ready for an intense ride.  NASCAR Thunder 2003 elevates the series to another level with deeper modes, new tracks, and a greater sense of speed.  Experience life in the fast lane through 20 seasons of Career mode, in which you must compete for top sponsors, the best crewmembers, and the latest racing technology.  All 23 Winston Cup tracks and the Daytona Beach road course can be raced with 14 tracks featuring both day and night racing.  NASCAR Thunder 2003 brings the speed and precision of NASCAR to your fingertips.",tbd,7.9
NBA Hoopz,PlayStation,"February 12, 2001","While still fun in head-to-head situations, the few added features can't mask the fact that NBA Hoopz is basically the same exact game as last year's NBA Showtime.",tbd,tbd
NBA Live 2001,PlayStation,"October 16, 2000",NBA Live 2001 follows the fine tradition established by previous versions while adding just about every conceivable gameplay option.,86,7.0
NBA Live 2002,PlayStation,"October 30, 2001",,81,7.5
NBA Live 2003,PlayStation,"October 8, 2002","Live your dream of NBA superstardom in NBA Live 2003. This year's installment in the NBA Live series features a new control system that lets you make quick steals, monster shot blocks, and smooth crossover dribbles. New animations show everything from power dunks and rebounds to signature moves and coaches' reactions. The game also features old NBA uniforms from basketball legends, such as Elgin Baylor, Jerry West, and Dr. J. Add to the mix fresh commentary and dialogue between player and coach, and you have a complete NBA experience. ",tbd,8.0
NBA ShootOut 2001,PlayStation,"October 30, 2000","989 has opted to take the easy road this time around, and the result is a basketball game that remains virtually unchanged from last year's version.",71,tbd
NBA ShootOut 2002,PlayStation,"September 1, 2001",NBA ShootOut 2002 is virtually identical to last year's game.,53,tbd
NBA ShootOut 2003,PlayStation,"September 29, 2002",,tbd,tbd
NCAA Final Four 2001,PlayStation,"November 13, 2000","NCCA Final Four 2001 features relatively entertaining arcade-style hoops action, but the game's subpar graphics, lack of options, annoying control flaws, and lack of on-court atmosphere keep it from meeting those expectations.",55,tbd
NCAA GameBreaker 2001,PlayStation,"August 21, 2000",NCAA GameBreaker 2001 is basically the same as last year's model.,69,tbd
NCAA March Madness 2001,PlayStation,"December 6, 2000",EA added the new coach mode and polished an already stellar game into the best college hoops simulation for the PlayStation.,71,tbd
NFL Blitz 2001,PlayStation,"September 14, 2000","NFL Blitz 2001 takes a low-key approach, delivering much the same features as last year's release while offering a number of minor refinements in key areas.",70,tbd
NFL GameDay 2001,PlayStation,"October 30, 2000","In the end, GameDay 2001, aside from its obvious roster updates and a few minor additions, is totally identical to last year's title, which was a really good game.",73,tbd
NFL GameDay 2002,PlayStation,"August 6, 2001",GameDay 2002 does a decent job of delivering a fun and somewhat realistic game of football to the PlayStation.,62,7.1
NFL GameDay 2003,PlayStation,"August 13, 2002","NFL GameDay 2003 is ready to kick off the new football season with updated teams, rosters, and players. All 32 NFL teams, including the expansion Houston Texans, are included in this year's NFL GameDay. You can make legendary plays with Total Control Passing and new offensive moves that allow you to break tackles, stiff-arm defenders, or dive over tacklers for the winning touchdown. Whether you're getting a workout in Training Camp mode, challenging opponents in Exhibition or Season modes, or playing multiple seasons in General Manager mode, NFL GameDay 2003 brings the NFL to life.",61,tbd
NFL GameDay 2004,PlayStation,"September 13, 2003","With NFL GameDay 2004, the NFL experience comes to life with new player models, pressure-sensitive controls, and all the best players in professional football. Each of the 180 players accurately reflects his real-life height, weight, body proportions, and accessories such as tinted visors and breathe strips. The game updates the playbooks with the latest trends on offense and defense. On offense, you have new features that allow better pass protection and the ability to change receiver routes; while on defense, you can shift your defensive lines and use new spin moves and swim techniques. ",tbd,7.0
NHL 2001,PlayStation,"September 26, 2000","While it's not the most beautiful hockey video game, NHL 2001 comes through where it counts - the gameplay.",88,7.4
NHL FaceOff 2001,PlayStation,"September 5, 2000","If you own either of the past two renditions of NHL FaceOff, you really have no reason to pick up 2001.",78,tbd
Need for Speed II,PlayStation,"March 31, 1997","Overall, Need For Speed II is the PlayStation's slickest racer yet.",71,6.2
Need for Speed: High Stakes,PlayStation,"March 1, 1999","It doesn't really mess with the formula of the last game, but adds enough new features and options to keep its fans excited.",86,8.4
Need for Speed: Porsche Unleashed,PlayStation,"February 29, 2000","Need for Speed: Porsche Unleashed tests your driving skills while you test-drive some of Porsche's most popular cars. In the game, you'll compete in levels that feature twists, turns, and various driving conditions. You can participate in different types of races, including circuit, streetcar, open road, and more. Survive all the crashes, police, and track challenges to earn prizes and respect. With enough money, you can purchase different custom parts for your vehicle.",78,8.3
Oddworld: Abe's Exoddus,PlayStation,"October 31, 1998","If you hated the first one, it's likely because of the lack of save points, so you should definitely consider giving this series another try.",88,8.6
Oddworld: Abe's Oddysee,PlayStation,"August 31, 1997","In a lush of diabolical danger where everyone wants to eat you, you're the skinny guy with no weapons. Run, jump, hide, scramble and talk your way past the ugliest bunch of carnivorous crustaceans ever created. Unlock Abe's special powers then figure out your foes, and you might save your race. Don't, and you're dinner! Enter Oddworld's surreal, sensory overload of pure gaming and claim your destiny.",85,8.8
One Piece Mansion,PlayStation,"September 30, 2001","Offering an unfamiliar style of addictive puzzle gameplay and boasting the personality of a vast assortment of wacky characters, One Piece Mansion is a fine buy for fans of the genre.",62,tbd
PaRappa the Rapper,PlayStation,"October 31, 1997",Help Parappa rap with the best of the master rappers and straight into Sunny's heart. Guaranteed you'll be singin' and dancin' along with Parappa and his pals to the most fun of mixes.,92,7.6
Parasite Eve,PlayStation,"September 9, 1998","One of them is a police officer. The other is possessed by an ancient evil threatening all life on Earth. The horrifying bond between them will continue until something dies. A chilling adventure that could only come from the creators of Final Fantasy VII. An epic sci-fi tale told through stunning 3D rendered sequences. Battle mutant monsters in real-time polygon combat. Customize weapons, armor, and character abilities.",81,8.9
Parasite Eve II,PlayStation,"September 12, 2000","Aya Brea is back. The Neo Mitochondrion Creature infestation has resurfaced and taken on a sinister twist. The outcome of this battle will determine earth's dominant species. Horrifying CG cinemas and sharper graphics bring the shocking new storyline to life as Aya hunts for the source of the outbreak. Fully-upgradable weapons, customizable armor, and a new, real-time battle system will aid in the conflict, along with powerful new Parasite Energy abilities.",79,8.7
Patriotic Pinball,PlayStation,"April 22, 2003",This USA-themed pinball game features no less than seven 3D tables with animated backgrounds.,tbd,tbd
Persona 2: Eternal Punishment,PlayStation,"December 22, 2000","Welcome back to the twisted world of Persona, where nightmares become reality and reality becomes a nightmare... Over 50 hours of dark twisted gameplay, plus stunning anime cinematics that absorb you into the intriguing world of Persona! Enlist the help of the nightmarish denizens of Persona through the use of the unique ""Contact System!"" Unleash total devastation by combining over 80 Persona to defeat the minions of evil. Change the fate of your characters by employing the revolutionary ""Rumor System.""",83,4.7
Peter Pan in Disney's Return to Neverland,PlayStation,"February 14, 2002",,59,5.4
Pipe Dreams 3D,PlayStation,"October 23, 2001",,tbd,tbd
Point Blank 3,PlayStation,"May 16, 2001","The shooting gallery madness of Point Blank has never been more zany, exciting, and fun. Join Dr. Don & Dr. Dan once again as they guide you through a whole new set of wacky games that will keep you partying for hours upon end.",78,8.6
Polaris SnoCross,PlayStation,"August 29, 2000","For snowmobile fans with a little extra cash to burn, Polaris SnoCross proves to be a rather entertaining diversion as long as you can accept its odd collision glitches.",57,tbd
Power Play: Sports Trivia,PlayStation,"May 6, 2002","Think You Got Game? Time to put up or shut up with Power Play Sports Trivia! Climb the ranking ladder, reach the Hall of Fame, and become a Trivia Legend. Take on 4,000 brain-bruising questions from the wide, wide world of football, basketball, baseball, and hockey. 2 Tenacious Trivia Modes: TOURNAMENT: Up to 4 players face off to decide who's got the fastest fingers and the maddest skills. LAST MAN STANDING: Avoid 5 wrong answers and go for the longest winning streak in history.",tbd,6.8
Power Spike Pro Beach Volleyball,PlayStation,"November 13, 2000","Power Spike Pro Beach Volleyball makes a good attempt, but its inconsistencies and shoddy control detract from the overall experience.",48,tbd
Pro Pinball: Big Race USA,PlayStation,"July 26, 2000","Even if you're not well steeped in the world of video pinball, the game's $9.99 price makes it well worth checking out.",69,tbd
Pro Pinball: Fantastic Journey,PlayStation,"July 14, 2000","Roll up! Roll up! Travel back to Victorian times with five steam-powered adventures. Use your flippers to tunnel to the Earth's core, journey to the ocean depths, fly through the tallest mountains and steam to a mysterious island to stop the evil General Yagov! Marvel at the most accurate ever ball physics! Balls that really spin, slide, roll and jump! Gasp in awe at the complexity of the table design, featuring bumpers, ramps, drop targets, magnets and more!",60,7.4
Putter Golf,PlayStation,"October 24, 2001","Take the fine pastime of miniature golf and add the zany characteristics of video game and you get Putter Golf - perhaps the most challenging mini-golf simulation ever made! 1 to 4 players compete on courses that defy gravity, bend physics and offer multiple mind-benders to the art of using a putter! Conveyer belts, warp holes, bounce-shock fences and much more add an all-new level of game play to the classic American sport!",tbd,tbd
R4: Ridge Racer Type 4,PlayStation,"May 1, 1999","""R4 has to be the best-looking PlayStation racer ever (yes, edging out even Gran Turismo)"" - Official PlayStation Magazine, December 1998",88,8.7
RC Revenge,PlayStation,"August 16, 2000",RC Revenge is intensely playable and highly polished - a far cry from its predecessor.,72,tbd
RC de GO!,PlayStation,"November 9, 2000","Fans of RC racers will surely find the game to be the most legitimate interpretation of the hobby on a console system to date, not to mention the most fun.",80,tbd
RPG Maker,PlayStation,"September 19, 2000","For the first time ever, RPG fanatics are given the chance to be true game designers. You construct an entire RPG using the massive library of in-game design tools: plot your story path, create an incredibly nasty boss, customize dungeons and maps, even animate your own title screen. When your RPG masterpiece is complete, save it and challenge friends to play through your one-of-a-kind fantasy adventure creation.",66,7.7
RayCrisis: Series Termination,PlayStation,"October 25, 2000","An ambitious and unethical scientist, a secret experiment gone horribly awry, and an artificially intelligent supercomputer gone mad; all the necessary ingredients for the imminent extinction of mankind. You are humanity's last hope, a hotshot pilot given the unenviable task of flying an experimental fighter into the dark heart of the Con-Human Network. Seize the controls of three Wave Rider spacecraft, each equippped with the WR-01 primary weapon array, WR-02 secondary lock-on laser system, and WR-03 single-use weapon for emergency situations. RayCrisis: Series Termination is the final entry in Taito's acclaimed trilogy of shooters, and it bombards your CRT with an abundance of fourth-generation optical stimulation: multilevel scrolling, transparency and lighting effects, and enough polygons to overload your cerebral cortex. Dodge, weave, and blast through two play modes, disintegrating wave after wave of relentless bogeys, to achieve high scores and unlock hidden bonuses. Prepare your senses, reinforce your nerves, and limber your trigger finger - the final assault has begun!",67,tbd
RayStorm,PlayStation,"December 31, 1996","Grab your oxygen mask and jump into the future of interplanetary defense. The year is 2219AD, and Earth's Star Federation has unleashed the R-GRAY advanced tactical combat fighter to save the planet from certain destruction at the hands of the bloodthirsty Secilia Federation. Despite impossible odds, you must now command a specially outfitted R-Gray fighter to defend Earth from certain destruction. Each fighter is equipped with lock-on lasters, pulse lasers, and a single devastating assault laser array that can destroy all sighted targets as once. Even with this technology at your disposal, the battle will not be easy. Earth's forces are depleted, and the merciless hordes of Secilia will settle for nothing less than complete annihilation of Earth. Fortunately, Star command has created two R-GRAY prototypes, so if you need extra firepower, a skilled friend can fly at your side. Whether you fly solo or with a friend, the intense sound, action, and arcade-perfect Hyper-3D visuals will blow you away!",79,7.5
Rayman Rush,PlayStation,"March 26, 2002","Rayman's world kicks into multiplayer overdrive in this total competition crash course with the cast of Rayman 2. Smoke the competition on mind-bending racecourses, or spark up a lum-flinging firefight in the battle arena. And with 8 characters, 24 maps and up to 4 combatants, now Rayman's got more ways to reign supreme than ever.",62,5.5
Razor Freestyle Scooter,PlayStation,"December 11, 2000","While the game is aimed at a younger crowd, it still manages to be good, albeit short-term, fun.",65,tbd
